name,id,description,genres,developers,publishers,released,esrb_rating.name,parent_platforms,playtime,metacritic,game_series_count,rating,rating_top,ratings_count,reddit_count,reviews_count,suggestions_count,twitch_count,youtube_count,slug,tags,game_names,Ratio,Partial_Ratio,Token_Sort_Ratio,Token_Set_Ratio,valid_name?
Let’s Sing 2020,Let's Sing 2020,Let's Sing 2021,Let's Sing,Let's Sing 2016,THE KING OF FIGHTERS 2000,,,,,,,,,,,,,,,,,Let's Sing 2020,93,93,100,100,Yes
RIDE 4 - Special Edition PS4 and PS5,Back 4 Blood: PS4 and PS5,Dracula 4 and 5 - Special,Devil May Cry 4: Special Edition,RIDE 4 PS4 and PS5,Jade Empire: Special Edition,,,,,,,,,,,,,,,,,RIDE 4 PS4 and PS5,67,72,69,100,Evaluate
OVERPASS Deluxe Edition,DISTRAINT: Deluxe Edition,Assassin's Creed 2 Deluxe Edition,Agricultural Simulator 2012: Deluxe Edition,Mass Effect: Andromeda Deluxe Edition,Paranautical Activity: Deluxe Atonement Edition,,,,,,,,,,,,,,,,,Agricultural Simulator 2012: Deluxe Edition,55,74,52,76,No
NAMCO MUSEUM® ARCHIVES Vol 2,Namco Museum Vol. 2,Namco Museum Vol. 3,Namco Museum Vol. 5,Namco Museum Vol. 1,Namco Museum Vol. 4,,,,,,,,,,,,,,,,,Namco Museum Vol. 2,77,68,80,100,Evaluate
Fishing Sim World®: Pro Tour - Collector’s Edition,Fishing Sim World: Pro Tour + Giant Carp Pack,Nearwood - Collector's Edition,Fishing Sim World: Pro Tour + The Catch: Carp & Coarse,Bear With Me - Collector's Edition,Ghost Encounters: Deadwood - Collector's Edition,,,,,,,,,,,,,,,,,Nearwood - Collector's Edition,62,80,62,81,No
Scott Pilgrim vs. The World™: The Game – Complete Edition,Scott Pilgrim vs. The World: The Game – Complete Edition,Scott Pilgrim vs. the World: The Game,SCOTT PILGRIM THE GAME,Scott Pilgrim vs. Street Fighter,Nioh: Complete Edition / 仁王 Complete Edition,,,,,,,,,,,,,,,,,Scott Pilgrim vs. The World: The Game – Complete Edition,99,98,100,100,Yes
Gal*Gun 2 - Complete Edition,Gal Gun: Double Peace,Gal*Gun 2,Nioh: Complete Edition / 仁王 Complete Edition,Trine 2: Complete Story,RollerCoaster Tycoon 3: Complete Edition,,,,,,,,,,,,,,,,,Gal*Gun 2,49,100,51,100,Evaluate
BioShock Infinite: The Complete Edition,Nioh: Complete Edition / 仁王 Complete Edition,BioShock Infinite,BioShock Infinite: Burial at Sea - Episode Two,BioShock: The Collection,BioShock Infinite: Burial at Sea - Episode One,,,,,,,,,,,,,,,,,BioShock Infinite,61,100,62,100,Yes
TT Isle of Man: Ride on the Edge 2,TT Isle of Man - Ride on the Edge,TT Isle of Man,Spider-Man: Edge of Time,TT Isle of Man Ride on the Edge 2,Spider-Man 2,,,,,,,,,,,,,,,,,TT Isle of Man Ride on the Edge 2,99,97,100,100,Yes
Tom Clancy’s The Division® Franchise Bundle,Tom Clancy’s The Division,Tom Clancy’s The Division 2,Tom Clancy's The Division - Underground,Tom Clancy’s The Division - Survival,Tom Clancy's H.A.W.X.,,,,,,,,,,,,,,,,,Tom Clancy’s The Division,74,100,75,100,Yes
The Crew® 2,The Crew 2,The Crew,Star Trek: Bridge Crew,Brew Crew! - Bonfire Jam,The Crow's Eye,,,,,,,,,,,,,,,,,The Crew 2,95,90,100,100,Evaluate
ONE PUNCH MAN: A HERO NOBODY KNOWS Edição Deluxe,One Punch Man: A Hero Nobody Knows,One Punch Man: Road To Hero,One Finger Death Punch,One-Punch Man:Road to Hero 2.0,Nobody Knows - Spooktober Jam,,,,,,,,,,,,,,,,,One Punch Man: A Hero Nobody Knows,83,100,85,100,Yes
Knightin’+,Knightin',Knightin'+,Portal Knights,Batman: Gotham Knights,Hollow Knight,,,,,,,,,,,,,,,,,Knightin'+,90,90,100,100,Evaluate
CHUBBY PIXEL MEGA BUNDLE,Mega Man (1987),Pixel Worlds,Mega Man X2,Mega Man 9(2008),A Pixel Story,,,,,,,,,,,,,,,,,Mega Man (1987),31,40,32,47,No
DRAGON BALL Z: KAKAROT - Edição de Luxo,Dragon Ball Z: Kakarot,Dragon Ball Z: Budokai,Dragon Ball Z: Battle of Z,Dragon Ball Z: Budokai 3,Dragon Ball Z: Budokai Tenkaichi 2,,,,,,,,,,,,,,,,,Dragon Ball Z: Kakarot,72,100,76,100,Yes
Graveyard Keeper Collector’s Edition,Nearwood - Collector's Edition,Graveyard Keeper,Bear With Me - Collector's Edition,Ghost Encounters: Deadwood - Collector's Edition,The Last Door - Collector's Edition,,,,,,,,,,,,,,,,,Graveyard Keeper,62,100,62,100,Yes
STEINS;GATE: My Darling’s Embrace,STEINS;GATE,STEINS;GATE 0,STEINS;GATE: Linear Bounded Phenogram,STEINS;GATE ELITE,Stein's Plan,,,,,,,,,,,,,,,,,STEINS;GATE,50,100,51,100,Evaluate
Pacote RV de Espire 1: VR Operative e Killing Floor: Incursion,Killing Floor: Incursion,Espire 1: VR Operative,Killing Floor - Toy Master,Killing Floor,Fairyland: Incursion,,,,,,,,,,,,,,,,,Killing Floor: Incursion,56,100,55,100,Yes
Woodle Tree 2: Deluxe+,Woodle Tree 2: Deluxe,Woodle Tree 2: Deluxe+,Woodle Tree 2: Worlds,Assassin's Creed 2 Deluxe Edition,Mahjong Deluxe 2: Astral Planes,,,,,,,,,,,,,,,,,Woodle Tree 2: Deluxe+,100,100,100,100,Yes
Farmer’s Dynasty,Farmer's Dynasty,The Deed: Dynasty,DYNASTY WARRIORS 9,Dynasty Warriors 8: Xtreme Legends,Medieval Dynasty,,,,,,,,,,,,,,,,,Farmer's Dynasty,94,94,100,100,Yes
Need for Speed™ Heat Edição Deluxe,Need for Speed Heat,Need for Speed: ProStreet,Need for Speed,Need for Speed: Shift,Need for Speed: Underground,,,,,,,,,,,,,,,,,Need for Speed,58,100,62,100,Yes
MediEvil,MediEvil (1998),Medievil,MediEvil 2,MediEvil (2019),MediEvil Resurrection,,,,,,,,,,,,,,,,,Medievil,100,100,100,100,Yes
MediEvil - Digital Deluxe,MediEvil (1998),Cossacks 3: Digital Deluxe,Talisman: Digital Edition,RollerCoaster Tycoon: Deluxe,Kirby: Triple Deluxe,,,,,,,,,,,,,,,,,MediEvil (1998),45,60,50,76,No
WWE 2K20 Deluxe Edition,DISTRAINT: Deluxe Edition,WWE 2K20,Assassin's Creed 2 Deluxe Edition,Agricultural Simulator 2012: Deluxe Edition,NBA 2K20,,,,,,,,,,,,,,,,,WWE 2K20,52,100,52,100,Yes
YU-NO: A girl who chants love at the bound of this world.,YU-NO: A girl who chants love at the bound of this world,YU-NO,At World’s End,A World of Keflings,Yu-Gi-Oh! Legacy of the Duelist,,,,,,,,,,,,,,,,,YU-NO: A girl who chants love at the bound of this world,99,100,100,100,Yes
WRC 8 Deluxe Edition FIA World Rally Championship,WRC 4 FIA World Rally Championship,WRC 7 FIA World Rally Championship,WRC: FIA World Rally Championship,WRC: FIA World Rally Championship (2006),WRC: FIA World Rally Championship Arcade,,,,,,,,,,,,,,,,,WRC: FIA World Rally Championship,78,88,79,100,Evaluate
Train Sim World® 2020 Deluxe Edition,Train Sim World: CSX Heavy Haul,Mystery Masters: Psycho Train Deluxe Edition,DISTRAINT: Deluxe Edition,Train Sim World,Accel World VS. Sword Art Online Deluxe Edition,,,,,,,,,,,,,,,,,Train Sim World,59,100,60,100,Yes
Edna and Harvey: Harvey’s New Eyes,Edna & Harvey: Harvey's New Eyes,Edna & Harvey: The Breakout,Edna & Harvey: The Breakout - Anniversary Edition,Harvey's Hundreds,Iron Harvest,,,,,,,,,,,,,,,,,Edna & Harvey: Harvey's New Eyes,91,88,94,100,Evaluate
The Savior’s Gang - Blessed Edition,The Savior's Gang,Jack's Gang,Gang Beasts,Tree of Savior (English Ver.),Barony: Blessed Addition,,,,,,,,,,,,,,,,,The Savior's Gang,62,94,68,100,Yes
DOOM (1993),DOOM (25th anniversary),Final DOOM,DOOM II,Kirby's Adventure (1993),DOOM (2016),,,,,,,,,,,,,,,,,Kirby's Adventure (1993),46,64,39,62,No
DOOM II (Classic),DOOM II (25th anniversary),DOOM II,Master Levels for Doom II,DOOM (2016),Ultimate Doom,,,,,,,,,,,,,,,,,DOOM II,58,100,64,100,Yes
Wolfenstein: Cyberpilot ,Wolfenstein: Cyberpilot,Wolfenstein: Youngblood,Wolfenstein: The New Order,Wolfenstein,Wolfenstein 2: The New Colossus,,,,,,,,,,,,,,,,,Wolfenstein: Cyberpilot,98,100,100,100,Yes
DRAGON QUEST BUILDERS 2 Digital Deluxe Edition,Assassin's Creed 2 Deluxe Edition,Dragon Quest Builders 2,Talisman: Digital Edition,DRAGON QUEST BUILDERS,Dragon Quest (1986),,,,,,,,,,,,,,,,,Dragon Quest Builders 2,67,100,67,100,Yes
Tennis World Tour: Roland-Garros Edition,Tennis World Tour,Virtua Tennis: World Tour,Roland Garros 2005: Powered by Smash Court Tennis,Airport Madness: World Edition,Table Top Racing: World Tour,,,,,,,,,,,,,,,,,Tennis World Tour,60,100,61,100,Yes
Bird Game +,Bird Game...,Bird Game,The King's Bird,Bird Game +,Flappy Bird: The Bird Game,,,,,,,,,,,,,,,,,Bird Game...,78,82,100,100,Evaluate
Space Hulk Bundle,Space Hulk: Tactics,SPACE HULK ASCENSION,Space Hulk: Deathwing,The Hulk,Space Hulk: Deathwing - Enhanced Edition,,,,,,,,,,,,,,,,,Space Hulk: Deathwing - Enhanced Edition,49,76,52,74,No
Suicide Guy Bundle,Suicide Guy: Sleepin' Deeply,Suicide Guy,Family Guy: BTTM,Family Guy: Back to the Multiverse,Mr. Suicide,,,,,,,,,,,,,,,,,Suicide Guy,76,100,76,100,Yes
Our World is Ended.,Our World Is Ended,Our Nation's Miner,! That Bastard Is Trying To Steal Our Gold !,Scarface: The World Is Yours,At World’s End,,,,,,,,,,,,,,,,,Our World Is Ended,97,100,100,100,Yes
World War Z,World War Z (2019),Z End: World War,RAID: World War II,Heroes Mobile: World War Z,Z (1996),,,,,,,,,,,,,,,,,Z End: World War,67,90,85,100,Evaluate
EARTH DEFENSE FORCE:IRON RAIN,Earth Defense Force: Iron Rain,Earth Defense Force: Insect Armageddon,Defend Earth: Rogue Defender,Defense corp - Earth,EARTH DEFENSE FORCE 4.1 The Shadow of New Despair,,,,,,,,,,,,,,,,,Earth Defense Force: Iron Rain,98,97,100,100,Yes
Generation Zero®,Generation Zero (2019),Agarest: Generations of War Zero,Generation Zero (2010),Sonic Generations,Hero Zero,,,,,,,,,,,,,,,,,Generation Zero (2019),79,94,86,100,Yes
The Legend of Heroes: Trails of Cold Steel,The Legend of Heroes VIII: Trails of Cold Steel,The Legend of Heroes: Trails of Cold Steel III,The Legend of Heroes VIII: Trails of Cold Steel II,The Legend of Heroes: Trails of Cold Steel IV,The Legend of Heroes: Trails of Cold Steel III Preorder,,,,,,,,,,,,,,,,,The Legend of Heroes: Trails of Cold Steel IV,97,100,96,100,Yes
LEFT ALIVE™ DAY ONE EDITION,LEFT ALIVE,Day One: Garry's Incident,Sunrider: Liberation Day - Captain's Edition,Left in the Dark: No One on Board,Phoenix Point: Year One Edition,,,,,,,,,,,,,,,,,LEFT ALIVE,54,100,56,100,Yes
Anthem™ Edição Standard,Anthem,Erica,Starward Rogue,P.A.C. MAN Standard,Cognition: An Erica Reed Thriller,,,,,,,,,,,,,,,,,Anthem,41,100,46,100,Evaluate
STEINS;GATE ELITE,STEINS;GATE,STEINS;GATE 0,STEINS;GATE: Linear Bounded Phenogram,STEINS;GATE ELITE,Stein's Plan,,,,,,,,,,,,,,,,,STEINS;GATE ELITE,100,100,100,100,Yes
Suicide Guy: Sleepin’ Deeply,Suicide Guy: Sleepin' Deeply,Suicide Guy,Family Guy: BTTM,Sleepin' Guy,Family Guy: Back to the Multiverse,,,,,,,,,,,,,,,,,Suicide Guy: Sleepin' Deeply,96,96,100,100,Yes
Fishing Sim World: Pro Tour + Quad Lake Pass,Fishing Sim World: Pro Tour + Giant Carp Pack,Fishing Sim World + Quad Lake Pass,Fishing Sim World: Pro Tour + The Catch: Carp & Coarse,roulettemin pro: world tour,Table Top Racing: World Tour,,,,,,,,,,,,,,,,,Fishing Sim World + Quad Lake Pass,87,71,88,100,Evaluate
Warhammer: Vermintide 2 - Edição Premium ,Warhammer: Vermintide 2,Warhammer: End Times - Vermintide,Warhammer: Vermintide VR - Hero Trials,Warhammer: Vermintide 2 - Shadows Over Bögenhafen,Total War: WARHAMMER II,,,,,,,,,,,,,,,,,Warhammer: Vermintide 2,72,100,77,100,Yes
Déraciné,Deracine,Déraciné,TERATINE,Shards of Eradine,PaperPlanes (samuel demaine),,,,,,,,,,,,,,,,,Déraciné,100,100,100,100,Yes
Call of Cthulhu®,Call of Cthulhu: Prisoner of Ice,Call of Cthulhu: Shadow of the Comet,Call of Cthulhu: The Wasted Land,Call of Cthulhu: Dark Corners of the Earth,Call of Cthulhu,,,,,,,,,,,,,,,,,Call of Cthulhu,97,100,100,100,Yes
For Honor® Marching Fire™ Edition,For Honor,Medal of Honor,Knights of Honor,Medal of Honor: Underground,Medal of Honor: Frontline,,,,,,,,,,,,,,,,,For Honor,43,100,45,100,Evaluate
The Surge - Augmented Edition,The Surge,Surge,The Surge 2,Surge Deluxe,The Manhole: Masterpiece Edition,,,,,,,,,,,,,,,,,The Surge,47,100,50,100,Evaluate
Assassin’s Creed® Odyssey Deluxe Edition,Assassin's Creed Odyssey,Assassin's Creed 2 Deluxe Edition,Assassin's Creed,Assassin's Creed: Director's Cut Edition,Assassin's Creed Unity,,,,,,,,,,,,,,,,,Assassin's Creed 2 Deluxe Edition,85,73,86,97,Evaluate
Assassin’s Creed® Odyssey Ultimate Edition,Assassin's Creed Odyssey,Assassin's Creed,Assassin's Creed: Director's Cut Edition,Assassin's Creed Unity,Assassin's Creed: Bloodlines,,,,,,,,,,,,,,,,,Assassin's Creed,52,94,56,100,Yes
Fishing Sim World®: Pro Tour Deluxe Edition,Fishing Sim World: Pro Tour + Giant Carp Pack,Fishing Sim World: Pro Tour + The Catch: Carp & Coarse,DISTRAINT: Deluxe Edition,Accel World VS. Sword Art Online Deluxe Edition,roulettemin pro: world tour,,,,,,,,,,,,,,,,,roulettemin pro: world tour,40,52,48,70,No
V-Rally 4 Ultimate Edition ,V-Rally 4,V-Rally (1997),Blasting Agent: Ultimate Edition,Cally's Caves 4,WRC 4 FIA World Rally Championship,,,,,,,,,,,,,,,,,V-Rally 4,50,100,51,100,Evaluate
SNK HEROINES Tag Team Frenzy,SNK Heroines: Tag Team Frenzy,Tag-Team Defense,American Tag-Team Wrestling,Capcom vs. SNK 2,Crash Tag Team Racing,,,,,,,,,,,,,,,,,SNK Heroines: Tag Team Frenzy,98,96,100,100,Yes
Fire Pro Wrestling World Deluxe Edition,Fire Pro Wrestling (Old),Fire Pro Wrestling World,DISTRAINT: Deluxe Edition,Accel World VS. Sword Art Online Deluxe Edition,Wrassling - Wacky Wrestling,,,,,,,,,,,,,,,,,Fire Pro Wrestling World,76,100,76,100,Yes
Terra-média™: Sombras da Guerra™ Edição Definitiva,Harmonikharath - Terras da Dissonância Sombria,PT - Protetor da terra,Sacra Terra: Angelic Night,Terra-Firma,Terra Inc.,,,,,,,,,,,,,,,,,Sacra Terra: Angelic Night,39,50,46,46,No
"Warhammer 40,000: Inquisitor - Martyr | Imperium edition","Warhammer 40,000: Inquisitor - Martyr","Warhammer 40,000: Inquisitor - Prophecy","Warhammer 40,000: Inquisitor - Martyr Complete Collection","Warhammer 40,000: Inquisitor - Martyr Complete Upgrade Pack","Warhammer 40,000: Deathwatch - Enhanced Edition",,,,,,,,,,,,,,,,,"Warhammer 40,000: Inquisitor - Martyr",80,100,80,100,Yes
THE KING OF FIGHTERS™ COLLECTION: THE OROCHI SAGA,THE KING OF FIGHTERS Collection: The Orochi Saga,THE KING OF FIGHTERS 2000,THE KING OF FIGHTERS 2002,THE KING OF FIGHTERS '97,The King of Fighters XIV,,,,,,,,,,,,,,,,,THE KING OF FIGHTERS Collection: The Orochi Saga,99,98,100,100,Yes
LEGO® Os Incríveis,LEGO The Hobbit,LEGO Batman,LEGO Racers,LEGO The Incredibles,LEGO Marvel's Avengers,,,,,,,,,,,,,,,,,LEGO Batman,41,55,44,53,No
Shaq-Fu: A Legend Reborn,Shaq Fu: A Legend Reborn,Kung Fu Panda: Showdown of Legendary Legends,Captain Legend: Reborn,Shaq Fu,The Dolls: Reborn,,,,,,,,,,,,,,,,,Shaq Fu: A Legend Reborn,96,96,100,100,Yes
Yoku’s Island Express,Yoku's Island Express,Sinking Island,Adventure Island (1986),Dead Island Riptide,Dead Island: Epidemic,,,,,,,,,,,,,,,,,Yoku's Island Express,95,95,100,100,Yes
PixelJunk™ Monsters 2,PixelJunk Monsters Ultimate,PixelJunk Monsters 2,Monster Prom 2: Monster Camp,PixelJunk Shooter 2,A Monster's Expedition,,,,,,,,,,,,,,,,,PixelJunk Monsters 2,98,95,100,100,Yes
PixelJunk™ Monsters 2 Deluxe Edition,PixelJunk Monsters Ultimate,PixelJunk Monsters 2,Assassin's Creed 2 Deluxe Edition,Mystery Masters: Psycho Train Deluxe Edition,DISTRAINT: Deluxe Edition,,,,,,,,,,,,,,,,,PixelJunk Monsters 2,71,95,73,100,Yes
Euro Fishing: Ultimate Edition,Euro Fishing,Ultimate Fishing,Blasting Agent: Ultimate Edition,Dragon Age: Origins - Ultimate Edition,Gears of War: Ultimate Edition,,,,,,,,,,,,,,,,,Euro Fishing,57,100,59,100,Yes
Tennis World Tour - Legends Edition,Tennis World Tour,Virtua Tennis: World Tour,WORLD OF WARSHIPS: LEGENDS,Airport Madness: World Edition,Table Top Racing: World Tour,,,,,,,,,,,,,,,,,Tennis World Tour,65,100,68,100,Yes
Call of Duty®: WWII - Edição Ouro,Call of Duty: WWII,Call of Duty,Call of Duty: Ghosts,Call of Duty: Mobile,Call of Duty: Warzone,,,,,,,,,,,,,,,,,Call of Duty,53,100,62,100,Yes
Assetto Corsa Ultimate Edition,Assetto Corsa Competizione,Assetto Corsa,Blasting Agent: Ultimate Edition,Dragon Age: Origins - Ultimate Edition,Gears of War: Ultimate Edition,,,,,,,,,,,,,,,,,Assetto Corsa,60,100,60,100,Yes
THE KING OF FIGHTERS ’97 GLOBAL MATCH,THE KING OF FIGHTERS '97 GLOBAL MATCH,THE KING OF FIGHTERS '97,THE KING OF FIGHTERS '98 ULTIMATE MATCH,THE KING OF FIGHTERS 2000,THE KING OF FIGHTERS 2002,,,,,,,,,,,,,,,,,THE KING OF FIGHTERS '97 GLOBAL MATCH,97,97,100,100,Yes
THE KING OF FIGHTERS™ ’98 ULTIMATE MATCH,THE KING OF FIGHTERS '98 ULTIMATE MATCH,THE KING OF FIGHTERS '98,THE KING OF FIGHTERS 2000,THE KING OF FIGHTERS 2002,The King of Fighters XIV,,,,,,,,,,,,,,,,,THE KING OF FIGHTERS '98 ULTIMATE MATCH,96,95,100,100,Yes
Warhammer Vermintide - The Ultimate Edition,Warhammer: Vermintide 2,Warhammer: End Times - Vermintide,Warhammer: Vermintide VR - Hero Trials,Into the Dark: Ultimate Trash Edition,"Warhammer 40,000: Deathwatch - Enhanced Edition",,,,,,,,,,,,,,,,,Warhammer: Vermintide 2,64,91,67,95,Evaluate
Euro Fishing: Castle Edition,Euro Fishing,Ultimate Fishing,Battle Fantasia -Revised Edition,Dead Rising 3 Apocalypse Edition,Euro Fishing: Foundry Dock + Season Pass,,,,,,,,,,,,,,,,,Euro Fishing,60,100,62,100,Yes
TT Isle of Man: Ride on the Edge,TT Isle of Man - Ride on the Edge,TT Isle of Man,Spider-Man: Edge of Time,TT Isle of Man Ride on the Edge 2,KRUM - Edge Of Darkness,,,,,,,,,,,,,,,,,TT Isle of Man - Ride on the Edge,95,94,100,100,Yes
Bleed Complete Bundle,Bleed,Bleed 2,Alien Breed: Impact,Victoria I Complete,Nioh: Complete Edition / 仁王 Complete Edition,,,,,,,,,,,,,,,,,Bleed,38,100,38,100,Evaluate
SHADOW OF THE COLOSSUS,Shadow of the Colossus (2011),Shadow of the Colossus,Shadow of the Colossus  (2018),The ICO & Shadow of the Colossus Collection,Wolfenstein 2: The New Colossus,,,,,,,,,,,,,,,,,Shadow of the Colossus,100,100,100,100,Yes
Digimon Story: Cyber Sleuth - Hacker’s Memory,Digimon Story Cyber Sleuth: Hacker’s Memory,Digimon Story Cyber Sleuth: Complete Edition,DIGIMON STORY CYBER SLEUTH,Cyber-Sleuth,Cyber Hacker 1.3,,,,,,,,,,,,,,,,,Digimon Story Cyber Sleuth: Hacker’s Memory,95,93,100,100,Yes
LocoRoco™ 2 Remastered,LocoRoco 2 Remastered,LocoRoco Remastered,LocoRoco 2,LocoRoco,Commandos 2 - HD Remaster,,,,,,,,,,,,,,,,,LocoRoco 2 Remastered,98,95,100,100,Yes
The Sims™ 4,The Sims 4,The Sims,The Sims 2: University,The Sims 2: Pets,The Sims 3 Pets,,,,,,,,,,,,,,,,,The Sims 4,95,90,100,100,Evaluate
Agents of Mayhem - Total Mayhem Bundle,Agents of Mayhem,Wolcen: Lords of Mayhem,Agents of Mayhem: Splatter Effect,Worms 4: Mayhem,State of Anarchy: Master of Mayhem,,,,,,,,,,,,,,,,,Agents of Mayhem,59,100,62,100,Yes
Need for Speed™ Payback,Need for Speed Payback,Need for Speed: ProStreet,Need for Speed,Need for Speed: Shift,Need for Speed: Underground,,,,,,,,,,,,,,,,,Need for Speed Payback,98,95,100,100,Yes
Wheel of Fortune®,Wheel of Fortune (Old),Fortune Wheel - Free Wheel Of Fortune Casino Games,Wheel of Fortune,Fortuna's Fortune,Wheel of Fortune: Show Puzzles,,,,,,,,,,,,,,,,,Wheel of Fortune,97,100,100,100,Yes
Call of Duty®: Black Ops III - Edição Zombies Chronicles,Call of Duty: Black Ops,Call of Duty: Black Ops III,Call of Duty: Black Ops 4,Call of Duty: Black Ops II,Call of Duty: Black Ops III - Zombies Deluxe,,,,,,,,,,,,,,,,,Call of Duty: Black Ops III,65,96,68,100,Yes
Jak and Daxter: The Precursor Legacy™,Jak and Daxter: The Precursor Legacy,Jak and Daxter: The Lost Frontier,Jak and Daxter Collection,The Precursors,Jak II,,,,,,,,,,,,,,,,,Jak and Daxter: The Precursor Legacy,99,100,100,100,Yes
Patapon™ Remastered,Patapon Remastered,Patapon 2 Remastered,Patapon,DuckTales: Remastered,StarCraft: Remastered,,,,,,,,,,,,,,,,,Patapon 2 Remastered,92,89,95,100,Evaluate
Titanfall™ 2: Edição Ultimate,Titanfall,Titanfall 2,Marvel: Ultimate Alliance 2,Naruto Shippuden: Ultimate Ninja Storm 2,Ultimate Word Search 2: Letter Boxed,,,,,,,,,,,,,,,,,Titanfall,47,100,53,100,Evaluate
Infinite Minigolf,Infinite Mini Golf,Ballpoint Universe - Infinite,Planet Minigolf,MiniGolf Mania,Marvel vs. Capcom: Infinite,,,,,,,,,,,,,,,,,Infinite Mini Golf,97,94,74,74,Evaluate
Euro Fishing: Urban Edition,Euro Fishing,Ultimate Fishing,Fishing King :The Urban Angler,Dead Rising 3 Apocalypse Edition,Urban Chaos,,,,,,,,,,,,,,,,,Euro Fishing,62,100,63,100,Yes
SpeedRunners Deluxe Bundle,SpeedRunners,SEUM: Speedrunners from Hell,RollerCoaster Tycoon: Deluxe,Kirby: Triple Deluxe,Speedrunner's Delight,,,,,,,,,,,,,,,,,SpeedRunners,63,100,63,100,Yes
LocoRoco™ Remastered,LocoRoco Remastered,LocoRoco 2 Remastered,LocoRoco,DuckTales: Remastered,StarCraft: Remastered,,,,,,,,,,,,,,,,,LocoRoco 2 Remastered,93,90,95,100,Evaluate
DRAGON QUEST HEROES II™ Edição do Explorador,Dragon Quest (1986),DRAGON QUEST HEROES II,DRAGON QUEST HEROES: The World Tree's Woe and the Blight Below,Dragon Quest Heroes: Rocket Slime,DRAGON QUEST HEROES Slime Edition,,,,,,,,,,,,,,,,,DRAGON QUEST HEROES II,67,100,70,100,Yes
Wonder Boy: The Dragon’s Trap,Wonder Boy: The Dragon's Trap,Wonder Boy III: The Dragon's Trap,Double Dragon 2: Wander of the Dragons,Hoo-Boy,Wonder Boy III The Dragons Trap,,,,,,,,,,,,,,,,,Wonder Boy: The Dragon's Trap,97,97,100,100,Yes
PaRappa The Rapper™ Remastered,PaRappa the Rapper (1996),PaRappa The Rapper Remastered,PaRappa The Rapper 2,Parappa the Rapper,Parappa the Rapper: Food Court Simulator,,,,,,,,,,,,,,,,,PaRappa The Rapper Remastered,98,97,100,100,Yes
FATAL FURY™ BATTLE ARCHIVES VOL.2,FATAL FURY BATTLE ARCHIVES VOL.2,Fatal Fury 2 (1992),NEKOPARA Vol. 2,Fatal Fury Special,Fatal Fury: Wild Ambition,,,,,,,,,,,,,,,,,FATAL FURY BATTLE ARCHIVES VOL.2,98,97,100,100,Yes
ADK DAMASHII™,ADK DAMASHII,Tamashii,Racing Damashii,TAMASHII (itch),Battle Robot Damashii,,,,,,,,,,,,,,,,,ADK DAMASHII,96,100,100,100,Yes
Assassin’s Creed® The Ezio Collection,Assassin’s Creed The Ezio Collection,Assassin's Creed,Assassin's Creed Unity,Assassin's Creed: Bloodlines,Assassin's Creed Syndicate,,,,,,,,,,,,,,,,,Assassin’s Creed The Ezio Collection,99,97,100,100,Yes
FU’UN SUPER COMBO™,FU'UN SUPER COMBO,Wombo Combo,Super Hexagon,Super Contra (1988),Super Punch-Out!!,,,,,,,,,,,,,,,,,FU'UN SUPER COMBO,91,94,100,100,Yes
The Escapists: Supermax Edition,The Escapists,The Escapists: The Walking Dead,The Escapist,The Escapists: Alcatraz,The Escapists 2,,,,,,,,,,,,,,,,,The Escapists,59,100,60,100,Yes
Overcooked Holiday Bundle,Overcooked,Overcooked! 2,Hatoful Boyfriend: Holiday Star,Holyday City: Reloaded,Overcooked - Recreation,,,,,,,,,,,,,,,,,Overcooked,57,100,57,100,Yes
GAROU: MARK OF THE WOLVES™,Garou: Mark of the Wolves,GAROU: MARK OF THE WOLVES (new),GAROU: MARK OF THE WOLVES (1998),GAROU: MARK OF THE WOLVES (2015),GAROU: MARK OF THE WOLVES (2016),,,,,,,,,,,,,,,,,Garou: Mark of the Wolves,98,100,100,100,Yes
Destroy All Humans! 2 (2006),Destroy All Humans!,Destroy All Humans! (2020),Destroy All Humans! 2,Destroy All Humans! Demo,Khimera: Destroy All Monster Girls,,,,,,,,,,,,,,,,,Destroy All Humans! 2,86,100,89,100,Yes
Steins;Gate 0,STEINS;GATE,STEINS;GATE 0,STEINS;GATE: Linear Bounded Phenogram,STEINS;GATE ELITE,Stein's Plan,,,,,,,,,,,,,,,,,STEINS;GATE 0,100,100,100,100,Yes
SAMURAI SHODOWN VI™,SAMURAI SHODOWN II,SAMURAI SHODOWN V SPECIAL,Samurai Shodown,Samurai Showdown (itch),Samurai Shodown III (2007),,,,,,,,,,,,,,,,,Samurai Shodown,88,100,91,100,Yes
Call of Duty®: Infinite Warfare - Digital Deluxe,Call of Duty: Infinite Warfare,Call of Duty: Advanced Warfare,Call of Duty: Modern Warfare (2019),Call of Duty: Modern Warfare Remastered,Call of Duty 4: Modern Warfare,,,,,,,,,,,,,,,,,Call of Duty: Infinite Warfare,77,97,79,100,Yes
Call of Duty®: Infinite Warfare - Legacy Edition,Call of Duty: Infinite Warfare,Call of Duty: Advanced Warfare - Gold Edition,Call of Duty: Advanced Warfare,Call of Duty: Modern Warfare Remastered,Call of Duty: Modern Warfare (2019),,,,,,,,,,,,,,,,,Call of Duty: Infinite Warfare,77,97,79,100,Yes
Pacote Hasbro Diversão para a Família – Edição Super,Diversion-A,Super Hexagon,Delores: A Thimbleweed Park Mini-Adventure,Erica,Super Contra (1988),,,,,,,,,,,,,,,,,Super Hexagon,22,38,31,56,No
Destroy All Humans! (2005),Destroy All Humans!,Destroy All Humans! (2020),Destroy All Humans! Demo,Destroy All Humans! 2,Khimera: Destroy All Monster Girls,,,,,,,,,,,,,,,,,Destroy All Humans! (2020),96,96,96,96,Yes
Team17 Indie Heroes,Team17 Indie Heroes Pack,Team Indie,Marvel Heroes,Flat Heroes,Shop Heroes,,,,,,,,,,,,,,,,,Team17 Indie Heroes Pack,88,100,88,100,Yes
Call of Duty®: Modern Warfare® Remastered,Call of Duty: Modern Warfare Remastered,Call of Duty 4: Modern Warfare,Call of Duty: Modern Warfare 2 Campaign Remastered,Call of Duty: Modern Warfare (2019),Call of Duty: Modern Warfare 3,,,,,,,,,,,,,,,,,Call of Duty: Modern Warfare Remastered,98,95,100,100,Yes
Tropico 5 - Complete Collection,Tropico 5: Complete Collection,Tropico 5,Sword of the Stars: Complete Collection,Age of Empires III: Complete Collection,Tropico 5: Inquisition,,,,,,,,,,,,,,,,,Tropico 5: Complete Collection,95,93,100,100,Yes
Air Conflicts: Double Pack,Air Conflicts: Vietnam,Air Conflicts: Secret Wars,Air Conflicts: Pacific Carriers,Air Conflicts Double Pack,Double Dragon,,,,,,,,,,,,,,,,,Air Conflicts Double Pack,98,96,100,100,Yes
Gal*Gun: Double Peace,Gal Gun: Double Peace,Gal*Gun: Double Peace - 'Pheromone Z' Item,Gal*Gun 2,Gal-X-E,GUN,,,,,,,,,,,,,,,,,Gal Gun: Double Peace,95,95,100,100,Yes
LEGO® Star Wars™: The Force Awakens,LEGO Star Wars: The Force Awakens,Star Wars: The Force Unleashed,LEGO Star Wars III - The Clone Wars,LEGO Star Wars - The Complete Saga,Lego Star Wars: The Video Game,,,,,,,,,,,,,,,,,LEGO Star Wars: The Force Awakens,97,94,100,100,Yes
Conjunto SMITE Pacote Supremo de Deuses,SMITE,De-Void,de Blob,Supreme Commander: Forged Alliance,Supreme Ruler: Cold War,,,,,,,,,,,,,,,,,SMITE,23,100,23,100,Evaluate
Homefront®: The Revolution ’Freedom Fighter’ Bundle,Homefront: The Revolution,Homefront: The Revolution - The Voice Of Freedom,Homefront: The Revolution Demo,Freedom Fighters,Homefront,,,,,,,,,,,,,,,,,Homefront,30,100,32,100,Evaluate
BUNDLE FAR CRY 4 + FAR CRY PRIMAL,Far Cry,Far Cry 2,Far Cry New Dawn,Far Cry Vengeance,Far Cry 3: Blood Dragon,,,,,,,,,,,,,,,,,Far Cry,35,100,37,100,Evaluate
