name,id,description,genres,developers,publishers,released,esrb_rating.name,parent_platforms,playtime,metacritic,game_series_count,rating,rating_top,ratings_count,reddit_count,reviews_count,suggestions_count,twitch_count,youtube_count,slug,tags,game_names,Ratio,Partial_Ratio,Token_Sort_Ratio,Token_Set_Ratio,valid_name?
Tom Clancy’s The Division™ Gold Edition,Tom Clancy’s The Division,Tom Clancy’s The Division 2,Tom Clancy's The Division - Underground,Tom Clancy’s The Division - Survival,Tom Clancy's Rainbow Six 3 Gold,,,,,,,,,,,,,,,,,Tom Clancy’s The Division 2,79,96,77,96,Yes
Plants vs. Zombies™ Garden Warfare 2: Edição Deluxe,Plants vs. Zombies Garden Warfare 2,Plants vs Zombies Garden Warfare,Plants vs. Zombies,Plants vs. Zombies Garden Warfare 2 - Frosty,Plants vs. Zombies 2: It's About Time,,,,,,,,,,,,,,,,,Plants vs. Zombies Garden Warfare 2,81,97,85,100,Yes
Gravity Rush™ Remastered,Gravity Rush Remastered,Gravity Rush,Gravity Rush 2,DuckTales: Remastered,Aeve:Zero Gravity,,,,,,,,,,,,,,,,,Gravity Rush Remastered,98,96,100,100,Yes
LEGO® Marvel’s Avengers,LEGO Marvel's Avengers,Marvel’s Avengers,LEGO Marvel's Avengers - Classic Captain Marvel Pack,LEGO Marvel's Avengers - The Avengers Explorer Character Pack,LEGO Marvel Super Heroes,,,,,,,,,,,,,,,,,LEGO Marvel's Avengers,93,91,100,100,Yes
PaRappa The Rapper 2™,PaRappa the Rapper (1996),PaRappa The Rapper 2,PaRappa The Rapper Remastered,Parappa the Rapper,Parappa the Rapper: Food Court Simulator,,,,,,,,,,,,,,,,,PaRappa The Rapper 2,98,100,100,100,Yes
STAR WARS™  Battlefront™ Ultimate Edition,Star Wars: Battlefront,STAR WARS Battlefront 2 (2005),Star Wars: Battlefront II (2017),STAR WARS - The Force Unleashed Ultimate Sith Edition,STAR WARS Battlefront,,,,,,,,,,,,,,,,,Star Wars: Battlefront,67,91,71,100,Yes
Need for Speed™,Need for Speed: ProStreet,Need for Speed,Need for Speed: Shift,Need for Speed: Underground,Need For Speed Undercover,,,,,,,,,,,,,,,,,Need for Speed,97,100,100,100,Yes
Assassin’s Creed® Syndicate,Assassin's Creed Syndicate,Assassin's Creed,Assassin's Creed Unity,Assassin's Creed: Bloodlines,Assassin's Creed Odyssey,,,,,,,,,,,,,,,,,Assassin's Creed Syndicate,94,92,100,100,Yes
DRAGON QUEST HEROES: Digital Slime Edition,Dragon Quest Heroes: Rocket Slime,DRAGON QUEST HEROES Slime Edition,Talisman: Digital Edition,Dragon Quest (1986),Scythe: Digital Edition,,,,,,,,,,,,,,,,,DRAGON QUEST HEROES Slime Edition,88,73,89,100,Evaluate
DRAGON QUEST HEROES: The World Tree’s Woe and the Blight Below,DRAGON QUEST HEROES: The World Tree's Woe and the Blight Below,Dragon Quest (1986),Heroes of Might and Magic: A Strategic Quest,Subnautica: Below Zero,Tibetan Quest: Beyond the World's End,,,,,,,,,,,,,,,,,DRAGON QUEST HEROES: The World Tree's Woe and the Blight Below,98,98,100,100,Yes
Journey™ Collector’s Edition,Nearwood - Collector's Edition,Bear With Me - Collector's Edition,Ghost Encounters: Deadwood - Collector's Edition,The Last Door - Collector's Edition,Twisted Lands Trilogy: Collector's Edition,,,,,,,,,,,,,,,,,Ghost Encounters: Deadwood - Collector's Edition,61,71,67,83,No
Tearaway™ Unfolded,Tearaway Unfolded,Tearaway,Unfolded: Camellia Tales,unfold (itch),unfold-ID,,,,,,,,,,,,,,,,,Tearaway Unfolded,97,94,100,100,Yes
Dying Light,Dying Light: The Following - Enhanced Edition,Dying Light,Dying Light: The Following,Dying Light: Bad Blood,Dying Light - Hellraid,,,,,,,,,,,,,,,,,Dying Light,100,100,100,100,Yes
Saints Row IV Re-Elected ,Saints Row IV: Re-Elected,Saints Row IV: Re-Elected & Gat out of Hell,Saints Row: The Third,Saints Row: The Third Remastered,Saints Row IV: Game of the Century Edition,,,,,,,,,,,,,,,,,Saints Row IV: Re-Elected,96,96,100,100,Yes
The Order: 1886™,The Order: 1886,Wolfenstein: The New Order,Order of War,Carrie's Order Up!,The Order of the Thorne - The King's Challenge,,,,,,,,,,,,,,,,,The Order: 1886,97,100,100,100,Yes
Assassin’s Creed® Unity,Assassin's Creed Unity,Assassin's Creed,Assassin's Creed: Bloodlines,Assassin's Creed Syndicate,Assassin's Creed Odyssey,,,,,,,,,,,,,,,,,Assassin's Creed Unity,93,91,100,100,Yes
LEGO® Batman™ 3: Além de Gotham Edição Luxo,LEGO Batman 3: Beyond Gotham,Batman: Gotham Knights,LEGO Batman,LEGO Batman 3: Beyond Gotham DLC: Rainbow Batman,LEGO Batman 3: Beyond Gotham DLC: Arrow,,,,,,,,,,,,,,,,,Batman: Gotham Knights,49,59,52,76,No
MotoGP™14,MotoGP 14,FIFA 14,NHL 14,MotoGP 13,MotoGP 15,,,,,,,,,,,,,,,,,MotoGP 14,89,89,100,100,Evaluate
Call of Duty®: Advanced Warfare - Edição Digital Pro,Call of Duty: Advanced Warfare,Call of Duty: Advanced Warfare - Gold Edition,Call of Duty: Advanced Warfare - Havoc,Call of Duty: Modern Warfare (2019),Call of Duty: Infinite Warfare,,,,,,,,,,,,,,,,,Call of Duty: Advanced Warfare,73,97,77,100,Yes
Lone Survivor: The Director’s Cut,Lone Survivor: The Director's Cut,Q.U.B.E: Director's Cut,Deadlight: Director's Cut,Mythos: The Beginning - Director's Cut,Scratches: Director's Cut,,,,,,,,,,,,,,,,,Lone Survivor: The Director's Cut,97,97,100,100,Yes
Shadow Warrior,Shadow Warrior (2013),Viscera Cleanup Detail: Shadow Warrior,Shadow Warrior Classic,Shadow Warrior 3,Shadow Warrior 2,,,,,,,,,,,,,,,,,Shadow Warrior (2013),80,100,85,100,Yes
Defense Grid 2,DG2: Defense Grid 2,Defense Grid 2,Defense Grid: The Awakening,Defense Grid,GRID Autosport,,,,,,,,,,,,,,,,,Defense Grid 2,100,100,100,100,Yes
Valiant Hearts: The Great War™,Valiant Hearts: The Great War,Descent: FreeSpace – The Great War (1998),Vagrant Hearts,Panzer Hearts - War Visual Novel,Sonya: The Great Adventure,,,,,,,,,,,,,,,,,Valiant Hearts: The Great War,98,100,100,100,Yes
Pure Chess® Complete Bundle,Pure Chess,Victoria I Complete,Pyre,Nioh: Complete Edition / 仁王 Complete Edition,Toy Soldiers: Complete,,,,,,,,,,,,,,,,,Pure Chess,54,100,56,100,Yes
Stealth Inc: Ultimate Edition,Stealth Inc: A Clone in the Dark,Stealth Inc 2: A Game of Clones,Blasting Agent: Ultimate Edition,Dragon Age: Origins - Ultimate Edition,Gears of War: Ultimate Edition,,,,,,,,,,,,,,,,,Blasting Agent: Ultimate Edition,72,76,58,73,No
Battlefield 4™,Battlefield 4,Battlefield: Bad Company,Battlefield 2: Modern Combat,Battlefield: Bad Company 2,Battlefield 4: Dragon's Teeth,,,,,,,,,,,,,,,,,Battlefield 4,96,100,100,100,Yes
Need for Speed™ Hot Pursuit Remastered,Need for Speed: Hot Pursuit Remastered,Need For Speed: Hot Pursuit,Need for Speed: Hot Pursuit 2,Need for Speed 3: Hot Pursuit,Need for Speed Hot Pursuit for iPad,,,,,,,,,,,,,,,,,Need for Speed: Hot Pursuit Remastered,97,97,100,100,Yes
Down the Rabbit Hole,Down The Rabbit Hole (itch),Down the Rabbit Hole,Resuffer: Down the Rabbit Hole,Wonderful Everyday Down the Rabbit-Hole,Rabbit-hole,,,,,,,,,,,,,,,,,Down the Rabbit Hole,100,100,100,100,Yes
Conjunto de Jogos LEGO®,Jogo de Damas - Os Clássicos jogos de tabuleiro,LEGO The Hobbit,LEGO Batman,LEGO Racers,LEGO The Incredibles,,,,,,,,,,,,,,,,,Jogo de Damas - Os Clássicos jogos de tabuleiro,43,52,45,54,No
White Day - Ultimate Horror Edition,Blasting Agent: Ultimate Edition,White Day: A Labyrinth Named School,Dragon Age: Origins - Ultimate Edition,Gears of War: Ultimate Edition,Fallout: New Vegas - Ultimate Edition,,,,,,,,,,,,,,,,,Gears of War: Ultimate Edition,62,63,68,71,No
The Sinking City: Necronomicon Edition,Necronomicon: The Dawning of Darkness,The Sinking City,Sinking Island,The Metronomicon: Slay the Dance Floor,Batman: Arkham City - Game of the Year Edition,,,,,,,,,,,,,,,,,The Sinking City,59,100,60,100,Yes
The Catch: Carp and Coarse Fishing,The Catch: Carp and Coarse,The Catch: Carp & Coarse,Fishing Sim World: Pro Tour + The Catch: Carp & Coarse,Ultimate Fishing,Fishing Rivals: Hook & Catch,,,,,,,,,,,,,,,,,The Catch: Carp and Coarse,87,100,86,100,Yes
Ultra Hat Dimension,Ultra Hat Dimension (itch),Ultra Hat Dimension,"Pokémon Ultra Sun, Ultra Moon",Ultra Hat Dimension (Ludum Dare version),A Hat in Time,,,,,,,,,,,,,,,,,Ultra Hat Dimension,100,100,100,100,Yes
Hunting Simulator 2 Bear Hunter Edition,Bear With Me - Collector's Edition,Borderlands 2: Game of the Year Edition,Dear Esther: Landmark Edition,Guilty Gear 2: Overture,Phoenix Point: Year One Edition,,,,,,,,,,,,,,,,,Guilty Gear 2: Overture,42,52,46,46,No
Jupiter and Mars,Jupiter & Mars,Nexus - The Jupiter Incident,Jupiter - Guardians,Mars: War Logs,Jupiter Hell,,,,,,,,,,,,,,,,,Jupiter & Mars,87,79,86,100,Evaluate
Train Sim World® 2: Deluxe Edition,Train Sim World: CSX Heavy Haul,Mystery Masters: Psycho Train Deluxe Edition,Assassin's Creed 2 Deluxe Edition,DISTRAINT: Deluxe Edition,Train Sim World,,,,,,,,,,,,,,,,,Train Sim World,61,100,64,100,Yes
WW1 Game Series Bundle,ARCADE GAME SERIES: GALAGA,Game of Thrones - A Telltale Games Series,ARCADE GAME SERIES: PAC-MAN,ARCADE GAME SERIES: DIG DUG,ARCADE GAME SERIES: Ms. PAC-MAN,,,,,,,,,,,,,,,,,Game of Thrones - A Telltale Games Series,38,55,46,67,No
Nicole,Nicole (itch),Nicole,Nicole (otome version),Nicole's Fears,Nicole Smith - Prototypes,,,,,,,,,,,,,,,,,Nicole,100,100,100,100,Yes
Kerbal Space Program Enhanced Edition Complete,Space Hulk: Deathwing - Enhanced Edition,Kerbal Space Program,Interplanetary: Enhanced Edition,Kerbal Space Program - Making History,Nioh: Complete Edition / 仁王 Complete Edition,,,,,,,,,,,,,,,,,Kerbal Space Program,61,100,61,100,Yes
Tennis World Tour 2 Ace Edition,Tennis World Tour,Virtua Tennis: World Tour,Ace Stickman Tennis - 2016 World Championship Edition,Creeper World 2: Anniversary Edition,Ace Combat Assault Horizon - Enhanced Edition,,,,,,,,,,,,,,,,,Tennis World Tour,71,100,71,100,Yes
The Catch: Carp and Coarse - Deluxe Edition,The Catch: Carp and Coarse,The Catch: Carp & Coarse,DISTRAINT: Deluxe Edition,Project CARS - Pagani Edition,Assassin's Creed 2 Deluxe Edition,,,,,,,,,,,,,,,,,The Catch: Carp and Coarse,75,100,77,100,Yes
ROBOTICS;NOTES DaSH,Robotics,Robotics Lab - prologue,Robotics!,War Robots VR: The Skirmish,Not The Robots,,,,,,,,,,,,,,,,,Robotics!,57,89,59,100,Evaluate
ROBOTICS;NOTES DOUBLE PACK,Robotics,Robotics Lab - prologue,Robotics!,War Robots VR: The Skirmish,Not The Robots,,,,,,,,,,,,,,,,,Robotics!,46,89,47,100,Evaluate
ROBOTICS;NOTES ELITE,Robotics,Robotics Lab - prologue,Robotics!,War Robots VR: The Skirmish,Not The Robots,,,,,,,,,,,,,,,,,Robotics!,55,89,57,100,Evaluate
CrossKrush PS4 and PS5,Spacebase Startopia - PS4 and PS5,No Man's Sky PS4 and PS5,Back 4 Blood: PS4 and PS5,Watch Dogs: Legion PS4 and PS5,Sackboy: A Big Adventure PS4 and PS5,,,,,,,,,,,,,,,,,Sackboy: A Big Adventure PS4 and PS5,52,59,42,67,No
NHL™ 21,NHL 21,FIFA 21,Madden NFL 21,NHL 12,NHL 13,,,,,,,,,,,,,,,,,NHL 21,92,83,100,100,Evaluate
Monster Truck Championship Rebel Hunter Edition,Monster Hunter Rise,Monster Hunter: World,Monster Hunter World: Iceborne,PAC-MAN Championship Edition DX+,PAC-MAN CHAMPIONSHIP EDITION 2,,,,,,,,,,,,,,,,,Monster Hunter: World,47,57,51,82,No
Warhammer: Chaosbane Slayer Edition,Warhammer: Chaosbane,"Warhammer 40,000: Deathwatch - Enhanced Edition",Warhammer: Vermintide 2,Warhammer: Arcane Magic,Gauntlet Slayer Edition,,,,,,,,,,,,,,,,,Warhammer: Chaosbane,73,100,72,100,Yes
Empire of Sin - Deluxe Edition,DISTRAINT: Deluxe Edition,Empire of Sin,Empire Deluxe Combined Edition,Jade Empire: Special Edition,Divinity: Original Sin - Enhanced Edition,,,,,,,,,,,,,,,,,Empire of Sin,60,100,63,100,Yes
Empire of Sin - Premium Edition,Empire of Sin,Dreamscapes: The Sandman - Premium Edition,Jade Empire: Special Edition,Governor of Poker 2 - Premium Edition,Divinity: Original Sin - Enhanced Edition,,,,,,,,,,,,,,,,,Empire of Sin,59,100,62,100,Yes
PACOTE TRIPLO DA EA STAR WARS™,Star Wars: Empire at War,Star Wars: Squadrons,Star Wars: Battlefront,STAR WARS Starfighter,Star Wars: Rebellion,,,,,,,,,,,,,,,,,Star Wars: Empire at War,44,50,65,65,No
The Outer Worlds: Pacote Aprovado pela Diretoria,The Outer Worlds,Outer Wilds,Pesa-Pesa,Outer Worlds demo v0.3,Albedo: Eyes From Outer Space,,,,,,,,,,,,,,,,,The Outer Worlds,50,100,51,100,Evaluate
Autumn’s Journey,Autumn's Journey,Autumn's Journey - Español,Autumn,Robinson: The Journey,LEAVES - The Journey,,,,,,,,,,,,,,,,,Autumn's Journey,94,94,100,100,Yes
Edição de Luxo de Paladins,De-Void,de Blob,Lab de Games - 3ª Edição,Laboratório de Games - 2ª Edição,De-formers,,,,,,,,,,,,,,,,,De-Void,24,43,32,44,No
Edição de Ouro de Paladins,De-Void,de Blob,Lab de Games - 3ª Edição,Laboratório de Games - 2ª Edição,Duro de fritar - Fry Hard,,,,,,,,,,,,,,,,,De-Void,24,43,32,44,No
Edição Inicial de Paladins,Paladins,Lab de Games - 3ª Edição,De-Void,de Blob,Laboratório de Games - 2ª Edição,,,,,,,,,,,,,,,,,Paladins,47,100,50,100,Evaluate
Steamroll: Rustless Edition,Steamroll,Rustler: Prologue,REsTLESs.,LoveKami -Useless Goddess,Ruthless Safari,,,,,,,,,,,,,,,,,Steamroll,50,100,51,100,Evaluate
Pacote 2K Ball N’ Brawl,Crawl N' Brawl,Crawl,Override: Mech City Brawl,BRAWL,Kaptain Brawe: A Brawe New World,,,,,,,,,,,,,,,,,BRAWL,36,100,37,100,Evaluate
Blood Bowl 2: Legendary Edition,Blood Bowl Legendary Edition,Blood Bowl: Chaos Edition,Blood Bowl: Death Zone,Blood Bowl 2,Mass Effect: Legendary Edition,,,,,,,,,,,,,,,,,Blood Bowl Legendary Edition,95,89,97,100,Evaluate
PixelJunk™ Shooter Ultimate,PixelJunk Monsters Ultimate,PixelJunk Shooter Ultimate,PixelJunk Shooter,PixelJunk Shooter 2,"PixelJunk, Inc.",,,,,,,,,,,,,,,,,PixelJunk Shooter Ultimate,98,96,100,100,Yes
THE KING OF FIGHTERS XIV Special Anniversary Edition,The King of Fighters XIV,The King of Fighters XIII,THE KING OF FIGHTERS 2000,THE KING OF FIGHTERS 2002,THE KING OF FIGHTERS '97,,,,,,,,,,,,,,,,,The King of Fighters XIV,63,100,63,100,Yes
