name,id,description,genres,developers,publishers,released,esrb_rating.name,parent_platforms,playtime,metacritic,game_series_count,rating,rating_top,ratings_count,reddit_count,reviews_count,suggestions_count,twitch_count,youtube_count,slug,tags,game_names,Ratio,Partial_Ratio,Token_Sort_Ratio,Token_Set_Ratio,valid_name?
The Metronomicon: Slay the Dance Floor - Deluxe,The Metronomicon: Slay the Dance Floor,Necronomicon: The Dawning of Darkness,Killing Floor: Incursion,Wooden Floor 2 - Resurrection,The Flood,,,,,,,,,,,,,,,,,The Metronomicon: Slay the Dance Floor,89,100,91,100,Yes
ARK: Survival Evolved Explorer’s Edition,ARK: Survival Evolved,ARK: Survival Of The Fittest,A-Calc for Ark Survival Evolve,Ark II,Halo: Combat Evolved,,,,,,,,,,,,,,,,,ARK: Survival Evolved,69,100,68,100,Yes
Fallout 4: Game of the Year Edition,Fallout 3: Game of the Year Edition,BADLAND: Game of the Year Edition,The Elder Scrolls IV: Oblivion Game of the Year Edition,Deus Ex: Game of the Year Edition,Borderlands 2: Game of the Year Edition,,,,,,,,,,,,,,,,,Fallout 3: Game of the Year Edition,97,97,97,97,Yes
Marvel vs. Capcom: Infinite - Standard Edition,Marvel vs. Capcom: Infinite,Ultimate Marvel vs. Capcom 3,Marvel vs. Capcom: Clash of Super Heroes,Marvel vs. Capcom: Origins,Marvel vs. Capcom 2: New Age of Heroes,,,,,,,,,,,,,,,,,Marvel vs. Capcom: Infinite,74,100,75,100,Yes
Dead Alliance™,Mortal Kombat: Deadly Alliance,Jagged Alliance: Deadly Games,Marvel Ultimate Alliance,Jagged Alliance: Crossfire,Jagged Alliance Flashback,,,,,,,,,,,,,,,,,Mortal Kombat: Deadly Alliance,59,86,62,76,Evaluate
Dead Alliance™: Multiplayer Edition,Dead Alliance: Multiplayer Beta,Jagged Alliance 1: Gold Edition,Killer is Dead - Nightmare Edition,Mortal Kombat: Deadly Alliance,Jagged Alliance: Deadly Games,,,,,,,,,,,,,,,,,Dead Alliance: Multiplayer Beta,88,90,83,91,Evaluate
Mega Man Legacy Collection 1 and 2 Combo Pack,Mega Man Legacy Collection 1 & 2 Combo Pack,Mega Man Legacy Collection 2 / ロックマン クラシックス コレクション 2,Mega Man X Legacy Collection 2,Mega Man Legacy Collection / ロックマン クラシックス コレクション,Mega Man X Legacy Collection,,,,,,,,,,,,,,,,,Mega Man Legacy Collection 1 & 2 Combo Pack,95,93,95,100,Yes
Sine Mora EX,Sine Mora,Sine Mora EX,Deus Ex,Deus Ex GO,La-Mulana EX,,,,,,,,,,,,,,,,,Sine Mora EX,100,100,100,100,Yes
Sundered®: Eldritch Edition,Sundered: Eldritch Edition,Eldritch,Sundered,Murdered: Soul Suspect,Daily Chthonicle: Editor's Edition,,,,,,,,,,,,,,,,,Sundered: Eldritch Edition,98,96,100,100,Yes
That’s You!,That's You!,Monster Loves You!,YOU DON'T KNOW JACK,All You Can Eat,Chocolate makes you happy,,,,,,,,,,,,,,,,,That's You!,91,91,100,100,Yes
Crash Bandicoot™ N. Sane Trilogy,Crash Bandicoot N. Sane Trilogy,Crash Bandicoot,Crash Bandicoot 3: Warped,Crash Bandicoot: Crash's Revenge,Crash Bandicoot: The Wrath of Cortex,,,,,,,,,,,,,,,,,Crash Bandicoot N. Sane Trilogy,98,97,100,100,Yes
Pacote Familiar EA,Familiar Unfamiliar,EA SPORTS MMA,EA SPORTS UFC,EA SPORTS NHL 16,EA SPORTS UFC 2,,,,,,,,,,,,,,,,,Familiar Unfamiliar,54,61,54,62,No
Injustice™ 2,Injustice 2,Injustice: Gods Among Us,Justice League: Injustice for All,Red Comrades 2: For the Great Justice. Reloaded,Injustice: Gods Among Us Ultimate Edition,,,,,,,,,,,,,,,,,Injustice 2,96,91,100,100,Yes
Resident Evil™ Code: Veronica X,Resident Evil Code: Veronica,Resident Evil Code: Veronica X (HD),Resident Evil - Code: Veronica X,Resident Evil Survivor 2 – Code: Veronica,Resident Evil: Village,,,,,,,,,,,,,,,,,Resident Evil - Code: Veronica X,95,94,100,100,Yes
Darksiders: Fury’s Collection - War and Death,Darksiders Fury's Collection - War and Death,Rome: Total War - Collection,Medieval: Total War - Collection,SHOGUN: Total War - Collection,God of War Collection,,,,,,,,,,,,,,,,,Darksiders Fury's Collection - War and Death,97,95,100,100,Yes
Troll and I™,SHENZHEN I/O,Troll and I,Stephen's Sausage Roll,Mountain Troll,ZRoll,,,,,,,,,,,,,,,,,Troll and I,96,100,100,100,Yes
Gem Smashers,Gem Smashers (2003),Gem Smashers,Gem Smashers (2011),Slasher's Keep,My Lands: Black Gem Hunting,,,,,,,,,,,,,,,,,Gem Smashers,100,100,100,100,Yes
Sublevel Zero - Redux,Sublevel Zero Redux,UNBOX: Newbie's Adventure and Sublevel Zero: Redux,Sublevel Zero,Offensive Combat: Redux!,Awkward Dimensions Redux,,,,,,,,,,,,,,,,,Sublevel Zero Redux,95,89,100,100,Evaluate
Sniper Elite 4 Deluxe Edition,DISTRAINT: Deluxe Edition,Sniper Elite 4,SimCity 4 Deluxe Edition,Trap Them - Sniper Edition,Sniper Elite: Nazi Zombie Army,,,,,,,,,,,,,,,,,Sniper Elite 4,65,100,65,100,Yes
NARUTO SHIPPUDEN™: Ultimate Ninja® STORM 4 ROAD TO BORUTO,NARUTO SHIPPUDEN: Ultimate Ninja STORM 4 ROAD TO BORUTO,NARUTO SHIPPUDEN: Ultimate Ninja STORM 4,NARUTO SHIPPUDEN: Ultimate Ninja STORM 3,Naruto Shippuden: Ultimate Ninja Storm 2,NARUTO SHIPPUDEN: Ultimate Ninja STORM Revolution,,,,,,,,,,,,,,,,,NARUTO SHIPPUDEN: Ultimate Ninja STORM 4 ROAD TO BORUTO,98,96,100,100,Yes
RESIDENT EVIL 7 biohazard,Resident Evil 7: Biohazard,Resident Evil 7 / Biohazard 7 Teaser: Beginning Hour,Resident Evil (2002),Resident Evil 6,Resident Evil Zero,,,,,,,,,,,,,,,,,Resident Evil 7: Biohazard,98,96,100,100,Yes
Watch Dogs 2 - Gold Edition,Watch Dogs Legion,Gothic II: Gold Edition,Watch Dogs 2,ARMA: Gold Edition,Venetica - Gold Edition,,,,,,,,,,,,,,,,,Watch Dogs 2,62,100,65,100,Yes
DRAGON BALL XENOVERSE Super Bundle,Dragon Ball: Xenoverse,Dragon Ball Xenoverse,DRAGON BALL XENOVERSE 2,Dragon Ball Z: Budokai,Dragon Ball Z: Kakarot,,,,,,,,,,,,,,,,,DRAGON BALL XENOVERSE 2,77,96,74,95,Yes
Battlefield™ 1,Battlefield 1,Battlefield 1 Revolution,Battlefield 1: Apocalypse,Battlefield: Bad Company,Battlefield 2: Modern Combat,,,,,,,,,,,,,,,,,Battlefield 1,96,92,100,100,Yes
O Pacote Jackbox Party 3,The Jackbox Party Pack 3,The Jackbox Party Pack 2,O-PACO,The Jackbox Party Trilogy,The Jackbox Party Pack,,,,,,,,,,,,,,,,,O-PACO,33,83,40,40,No
Virginia – Pacote de Edição Especial,Virginia,Lab de Games - 3ª Edição,De-Void,de Blob,Laboratório de Games - 2ª Edição,,,,,,,,,,,,,,,,,Virginia,36,100,40,100,Evaluate
Don’t Starve Together: Console Edition,Stellaris: Console Edition,Don't Starve Together,Gone Home: Console Edition,Don't Starve: Pocket Edition,Don't Starve,,,,,,,,,,,,,,,,,Don't Starve Together,68,95,72,100,Yes
The Witcher 3: Wild Hunt – Complete Edition,The Witcher 3: Game of the Year,The Witcher 3: Wild Hunt,The Witcher 3: Wild Hunt - Hearts of Stone,The Witcher 3: Wild Hunt - Blood and Wine,RollerCoaster Tycoon 3: Complete Edition,,,,,,,,,,,,,,,,,The Witcher 3: Wild Hunt,72,100,73,100,Yes
No Man’s Sky,No Man's Sky,No Man's Sky PS4 and PS5,No Man's Sky 2 electric boogaloo,Old Man's Journey,Star Sky - ブルームーン,,,,,,,,,,,,,,,,,No Man's Sky,92,92,100,100,Yes
Cast of the Seven Godsends – Redux ,Cast of the Seven Godsends,Metro: Last Light Redux,Ys SEVEN,Offensive Combat: Redux!,Conception II: Children of the Seven Stars,,,,,,,,,,,,,,,,,Cast of the Seven Godsends,85,100,90,100,Yes
LEGO® Star Wars™: LEGO® Star Wars™: The Force Awakens de Luxo,LEGO Star Wars: The Force Awakens,LEGO Star Wars III - The Clone Wars,Lego Star Wars: The Video Game,LEGO Star Wars - The Complete Saga,LEGO STAR WARS The Skywalker Saga,,,,,,,,,,,,,,,,,LEGO Star Wars III - The Clone Wars,56,71,61,78,No
Heart&Slash,Heart,Heart's Medicine - Hospital Heat,Heart's Medicine - Time to Heal,Heart of the Emberstone: Coliseum,Heart's Medicine Hospital Heat,,,,,,,,,,,,,,,,,Heart,62,100,62,100,Yes
Umbrella Corps,Umbrella Corps /Biohazard Umbrella Corps,Panzer Corps,Contra: Hard Corps,Hard Corps: Uprising,Contra Rogue Corps,,,,,,,,,,,,,,,,,Umbrella Corps /Biohazard Umbrella Corps,52,100,53,100,Yes
Umbrella Corps Deluxe Edition,Umbrella Corps /Biohazard Umbrella Corps,DISTRAINT: Deluxe Edition,Assassin's Creed 2 Deluxe Edition,Agricultural Simulator 2012: Deluxe Edition,Mass Effect: Andromeda Deluxe Edition,,,,,,,,,,,,,,,,,Umbrella Corps /Biohazard Umbrella Corps,58,59,50,74,No
DOOM,DOOM (2016),DOOM,DOOM II,DOOM (25th anniversary),DOOM II (25th anniversary),,,,,,,,,,,,,,,,,DOOM,100,100,100,100,Yes
"Invisible, Inc. Console Edition","Invisible, Inc.",Stellaris: Console Edition,Gone Home: Console Edition,"Invisible, Inc. Contingency Plan",Demolition Inc.,,,,,,,,,,,,,,,,,"Invisible, Inc.",65,100,62,100,Yes
DARK SOULS™ III,Dark Fall 3: Lost Souls,Dark Souls: Remastered,Dark Souls III: Ashes of Ariandel,Dark Souls III: The Ringed City,Dark Souls III,,,,,,,,,,,,,,,,,Dark Souls III,97,93,100,100,Yes
BEB: Super Mega Bundle,Super Mega Baseball: Extra Innings,SUPER MEGA BASEBALL,Mega Man (1987),Mega Man X2,Half Minute Hero: Super Mega Neo Climax Ultimate Boy,,,,,,,,,,,,,,,,,Super Mega Baseball: Extra Innings,50,64,59,65,No
Blast ’Em Bunnies,Blast 'Em Bunnies,Blast Em!,EM: Shader Attack,Blast-off,Bunnies vs. Bunnies,,,,,,,,,,,,,,,,,Blast 'Em Bunnies,94,94,100,100,Yes
The Witch and the Hundred Knight: Revival Edition,The Witch and the Hundred Knight,Driftland: The Magic Revival,Last Knight: Rogue Rider Edition,The Joylancer: Legendary Motor Knight,Night in the Woods,,,,,,,,,,,,,,,,,The Witch and the Hundred Knight,79,100,80,100,Yes
Atualização de Rainbow Moon para PS4™,Rainbow Moon,Juego de Papá para Lisan :),De-Void,Tom Clancy's Rainbow Six,de Blob,,,,,,,,,,,,,,,,,Rainbow Moon,49,100,52,100,Evaluate
Randal’s Monday,Randal's Monday,it's always monday,Yu Escape / Monday,Monday Night Combat,Loot Rascals,,,,,,,,,,,,,,,,,Randal's Monday,93,93,100,100,Yes
Street Fighter™ V,Street Fighter V CFN Beta,Street Fighter Alpha 3 (1998),Street Fighter III: 3rd Strike,Street Fighter II: Champion Edition,Street Fighter V,,,,,,,,,,,,,,,,,Street Fighter V,97,94,100,100,Yes
NARUTO SHIPPUDEN™: Ultimate Ninja® STORM 4,NARUTO SHIPPUDEN: Ultimate Ninja STORM 4,Naruto Shippuden: Ultimate Ninja Storm 2,NARUTO SHIPPUDEN: Ultimate Ninja STORM Revolution,NARUTO SHIPPUDEN: Ultimate Ninja STORM 3,NARUTO SHIPPUDEN: Ultimate Ninja STORM Generations,,,,,,,,,,,,,,,,,NARUTO SHIPPUDEN: Ultimate Ninja STORM 4,98,95,100,100,Yes
LEGO® Marvel’s Avengers Edição de Luxo,LEGO Marvel's Avengers,Marvel’s Avengers,LEGO Marvel's Avengers - Classic Captain Marvel Pack,LEGO Marvel's Avengers - The Avengers Explorer Character Pack,LEGO Marvel Super Heroes,,,,,,,,,,,,,,,,,Marvel’s Avengers,62,100,65,100,Yes
Resident Evil 0,Resident Evil 0 / biohazard 0 HD REMASTER,Resident Evil Zero,Resident Evil: Village,Resident Evil (2002),Resident Evil Revelations,,,,,,,,,,,,,,,,,Resident Evil 0 / biohazard 0 HD REMASTER,54,100,56,100,Yes
Earth Defense Force 4.1: The Shadow of New Despair,EARTH DEFENSE FORCE 4.1 The Shadow of New Despair,Earth Defense Force: Iron Rain,Earth Defense Force: Insect Armageddon,EARTH DEFENSE FORCE 4.1 WINGDIVER THE SHOOTER,Middle-earth: Shadow of Mordor,,,,,,,,,,,,,,,,,EARTH DEFENSE FORCE 4.1 The Shadow of New Despair,99,98,100,100,Yes
BEYOND: Two Souls™,BEYOND: Two Souls,Heavy Rain & Beyond: Two Souls Collection,The Heavy Rain & BEYOND: Two Souls Collection,Demon's Souls,Beyond Divinity,,,,,,,,,,,,,,,,,BEYOND: Two Souls,97,100,100,100,Yes
Resident Evil Revelations 2 Edição de Luxo,Resident Evil Revelations,Resident Evil Revelations 2 / Biohazard Revelations 2,Resident Evil 2,Resident Evil: Revelations 2 - Episode 1: Penal Colony,Resident Evil: Village,,,,,,,,,,,,,,,,,Resident Evil Revelations,75,100,77,100,Yes
Bloodborne™ Complete Edition Bundle,Bloodborne,Nioh: Complete Edition / 仁王 Complete Edition,RollerCoaster Tycoon 3: Complete Edition,Lili: Child of Geos - Complete Edition,Mortal Kombat Komplete Edition,,,,,,,,,,,,,,,,,Bloodborne,44,100,45,100,Evaluate
Resident Evil,Resident Evil (2002),Resident Evil,Resident Evil: Village,Resident Evil Revelations,Resident Evil 6,,,,,,,,,,,,,,,,,Resident Evil,100,100,100,100,Yes
Terraria: PS4™ Edition,Terraria,ProGuide-Terraria edition,Terraria: Otherworld,Test Drive: Ferrari Racing Legends,Daily Chthonicle: Editor's Edition,,,,,,,,,,,,,,,,,Terraria,53,100,57,100,Yes
Battlefield 4™ Premium Edition,Battlefield 4,Dreamscapes: The Sandman - Premium Edition,Dreamscapes: Nightmare's Heir - Premium Edition,Sister’s Secrecy: Arcanum Bloodlines - Premium Edition,Governor of Poker 2 - Premium Edition,,,,,,,,,,,,,,,,,Battlefield 4,60,100,62,100,Yes
Plants vs. Zombies™ Garden Warfare,Plants vs Zombies Garden Warfare,Plants vs. Zombies Garden Warfare 2,Plants vs. Zombies,Plants vs. Zombies Garden Warfare 2 - Frosty,Plants vs. Zombies GOTY Edition,,,,,,,,,,,,,,,,,Plants vs Zombies Garden Warfare,97,94,100,100,Yes
The Last Of Us™ Remastered ,The Last of Us Part II,The Last Of Us Remastered,The Last of Us: Left Behind,The Last Of Us,The Last Remnant Remastered,,,,,,,,,,,,,,,,,The Last Of Us Remastered,96,96,100,100,Yes
Don’t Starve: Console Edition,Stellaris: Console Edition,Gone Home: Console Edition,Don't Starve: Pocket Edition,Don't Starve,Don't Starve: Nintendo Switch Edition,,,,,,,,,,,,,,,,,Don't Starve,54,92,60,100,Yes
LEGO® Marvel™ Super Heroes,LEGO Marvel Super Heroes,Marvel Heroes,LEGO Marvel's Avengers,LEGO Batman 2 DC Super Heroes,Marvel vs. Capcom: Clash of Super Heroes,,,,,,,,,,,,,,,,,LEGO Marvel Super Heroes,96,92,100,100,Yes
Wreckfest - Complete Edition,Wreckfest,Nioh: Complete Edition / 仁王 Complete Edition,RollerCoaster Tycoon 3: Complete Edition,Lili: Child of Geos - Complete Edition,Mortal Kombat Komplete Edition,,,,,,,,,,,,,,,,,Wreckfest,49,100,51,100,Evaluate
MotoGP™20,MotoGP 14,FIFA 20,MotoGP 20,MotoGP 13,MotoGP 15,,,,,,,,,,,,,,,,,MotoGP 20,89,89,100,100,Evaluate
SnowRunner - Premium Edition,SnowRunner,Dreamscapes: The Sandman - Premium Edition,Dreamscapes: Nightmare's Heir - Premium Edition,Sister’s Secrecy: Arcanum Bloodlines - Premium Edition,Governor of Poker 2 - Premium Edition,,,,,,,,,,,,,,,,,SnowRunner,53,100,56,100,Yes
The Surge 1 and 2 - Dual Pack,The Surge 1 & 2 - Dual Pack,The Surge 2,GunZ 2: The Second Duel,The Dream Machine: Chapter 1 & 2,1-2-Switch,,,,,,,,,,,,,,,,,The Surge 1 & 2 - Dual Pack,93,89,92,100,Evaluate
"Conan Exiles – Complete Edition, maio de 2020",Conan Exiles,Nioh: Complete Edition / 仁王 Complete Edition,RollerCoaster Tycoon 3: Complete Edition,Age of Conan: Unchained,Conan,,,,,,,,,,,,,,,,,Conan Exiles,42,100,44,100,Evaluate
Sakura Wars Digital Deluxe Edition,Iron Front: Digital War Edition,Talisman: Digital Edition,Scythe: Digital Edition,Gloom: Digital Edition,DISTRAINT: Deluxe Edition,,,,,,,,,,,,,,,,,Gloom: Digital Edition,57,68,58,83,No
The Last of Us Part II Digital Deluxe Edition,The Last of Us Part II,SpellForce 2 - Demons of the Past,Assassin's Creed 2 Deluxe Edition,Talisman: Digital Edition,Scythe: Digital Edition,,,,,,,,,,,,,,,,,The Last of Us Part II,66,100,66,100,Yes
The Elder Scrolls Online: Greymoor Collector’s Edition,The Elder Scrolls Online: Greymoor,The Elder Scrolls Online: Elsweyr,The Elder Scrolls Online: Morrowind,The Elder Scrolls Online: Tamriel Unlimited,The Elder Scrolls: Blades,,,,,,,,,,,,,,,,,The Elder Scrolls Online: Greymoor,77,100,77,100,Yes
F1 2020 - Deluxe Schumacher Edition,DISTRAINT: Deluxe Edition,F1 2020,F1 2017,F1 2010,Assassin's Creed 2 Deluxe Edition,,,,,,,,,,,,,,,,,F1 2020,33,100,35,100,Evaluate
Edição Deluxe de Captain Tsubasa: Rise of New Champions,Captain Tsubasa: Rise of New Champions,Captain Tsubasa: New Kick Off,Captain Tsubasa: Dream Team,Kaptain Brawe: A Brawe New World,FIVE: Champions of Canaan,,,,,,,,,,,,,,,,,Captain Tsubasa: Rise of New Champions,82,100,83,100,Yes
Rock of Ages 3: Make and Break,Rock of Ages 3: Make & Break,Rock of Ages 2: Bigger & Boulder,Rock of Ages,Guitar Hero 3: Legends of Rock,Ice Age 3 Dawn of the Dinosaurs,,,,,,,,,,,,,,,,,Rock of Ages 3: Make & Break,93,89,93,100,Evaluate
Remnant: From the Ashes – Complete Edition,Remnant: From the Ashes,Nioh: Complete Edition / 仁王 Complete Edition,Mass Effect 3: From Ashes,RollerCoaster Tycoon 3: Complete Edition,Sunset's Ashes,,,,,,,,,,,,,,,,,Remnant: From the Ashes,71,100,72,100,Yes
eFootball PES 2021 SEASON UPDATE ARSENAL EDITION,eFootball PES 2021,eFootball PES 2022,eFootball PES 2020,Pro Evolution Soccer 2011,Pro Evolution Soccer 2012,,,,,,,,,,,,,,,,,eFootball PES 2021,55,100,55,100,Yes
eFootball PES 2021 SEASON UPDATE FC BARCELONA EDITION,eFootball PES 2021,eFootball PES 2022,eFootball PES 2020,Pro Evolution Soccer 2011,Pro Evolution Soccer 2012,,,,,,,,,,,,,,,,,eFootball PES 2021,51,100,51,100,Yes
eFootball PES 2021 SEASON UPDATE FC BAYERN MÜNCHEN EDITION,eFootball PES 2021,eFootball PES 2022,eFootball PES 2020,Pro Evolution Soccer 2011,Pro Evolution Soccer 2012,,,,,,,,,,,,,,,,,eFootball PES 2021,47,100,48,100,Evaluate
eFootball PES 2021 SEASON UPDATE JUVENTUS EDITION,eFootball PES 2021,eFootball PES 2022,eFootball PES 2020,Pro Evolution Soccer 2011,Pro Evolution Soccer 2012,,,,,,,,,,,,,,,,,eFootball PES 2021,54,100,54,100,Yes
eFootball PES 2021 SEASON UPDATE MANCHESTER UNITED EDITION,eFootball PES 2021,eFootball PES 2022,Manchester United (Old),eFootball PES 2020,Manchester United: The Double,,,,,,,,,,,,,,,,,eFootball PES 2021,47,100,47,100,Evaluate
Black Desert: Conqueror Edition,Black Desert Online,SanctuaryRPG: Black Edition,Painkiller: Black Edition,Conqueror's Blade,Zero Reflex: Black Eye Edition,,,,,,,,,,,,,,,,,Black Desert Online,68,79,61,77,No
Black Desert: Explorer Edition,Black Desert Online,SanctuaryRPG: Black Edition,Painkiller: Black Edition,Zero Reflex: Black Eye Edition,Penumbra: Black Plague Gold Edition,,,,,,,,,,,,,,,,,Black Desert Online,65,74,71,77,No
Black Desert: Traveler Edition,Black Desert Online,SanctuaryRPG: Black Edition,Painkiller: Black Edition,Octopath Traveler,Zero Reflex: Black Eye Edition,,,,,,,,,,,,,,,,,Black Desert Online,65,74,71,77,No
Skully,Skully(itch),Skully,Sally Face,Bully: Scholarship Edition,Frayed Knights: The Skull of S'makh-Daon,,,,,,,,,,,,,,,,,Skully,100,100,100,100,Yes
Train Sim World® 2,Train Sim World: CSX Heavy Haul,Train Sim World,Trainz: Murchison 2,Small World 2,Prime World: Defenders 2,,,,,,,,,,,,,,,,,Train Sim World,91,100,94,100,Yes
Railway Empire - Complete Collection,Railway Empire – Complete Collection,Age of Empires III: Complete Collection,Railway Empire,Railway Empire - Germany,Railway Empire - France,,,,,,,,,,,,,,,,,Railway Empire – Complete Collection,97,97,100,100,Yes
VELOZES E FURIOSOS ENCRUZILHADA,Gon' E-Choo!,Gal-X-E,E-Sport Manager,WALL-E: The Video Game,Garfield Kart - Furious Racing,,,,,,,,,,,,,,,,,Gon' E-Choo!,23,33,34,39,No
New Super Lucky’s Tale,New Super Lucky's Tale,Super Lucky's Tale,Lucky's Tale,New Super Mario Bros.,New Super Mario Bros. Wii,,,,,,,,,,,,,,,,,New Super Lucky's Tale,95,95,100,100,Yes
FUSER™ VIP Edition,Fuser,Fuse,Daily Chthonicle: Editor's Edition,Nearwood - Collector's Edition,Catan: Creator's Edition,,,,,,,,,,,,,,,,,Fuser,43,100,45,100,Evaluate
FUSER™,Fuser,Fuse,FUSED (itch),H-Fuse,"Hello, User.",,,,,,,,,,,,,,,,,Fuser,91,100,100,100,Yes
The Walking Dead Onslaught: Digital Deluxe,OVERKILL's The Walking Dead,The Walking Dead: Michonne,The Escapists: The Walking Dead,The Walking Dead: Season 1,The Walking Dead: Survival Instinct,,,,,,,,,,,,,,,,,OVERKILL's The Walking Dead,46,59,65,74,No
Motorbike Racing Bundle,Motorbike Racing - Moto Racer,Motorbike.,Blocky Motorbikes . Crazy GP Motorbike Racing Game,A.I.M. Racing,Beach Water Surfer Bike Racing - Motorbike Riding,,,,,,,,,,,,,,,,,Motorbike.,55,90,56,100,Evaluate
Warface: Breakout – Edição Definitiva,Warface: Breakout,Warface 2017: Türkiye,Warface: Ice Breaker,Warface,Armored Warfare,,,,,,,,,,,,,,,,,Warface: Breakout,63,100,67,100,Yes
Let’s Sing Queen,Let's Sing Queen,Let's Sing,Let's Sing 2016,Sing-Song Ding-Dong,Let's Swing,,,,,,,,,,,,,,,,,Let's Sing Queen,94,94,100,100,Yes
Dead by Daylight: Special Edition,Dead by Daylight: Clicker,Dead by Daylight,Jade Empire: Special Edition,Lords of Magic: Special Edition,Killer is Dead - Nightmare Edition,,,,,,,,,,,,,,,,,Dead by Daylight,65,100,67,100,Yes
Jurassic World Evolution: Edição Jurassic Park,Jurassic World Evolution,Jurassic Park: The Game,LEGO Jurassic World,Jurassic World Evolution: Dinosaur Collection,Jurassic World Evolution: Expansion Collection,,,,,,,,,,,,,,,,,Jurassic World Evolution,69,100,72,100,Yes
Macrotis: A Mother’s Journey,Macrotis: A Mother's Journey,Two Brothers: A Lovely Journey,Robinson: The Journey,LEAVES - The Journey,Brothers: A Tale of Two Sons,,,,,,,,,,,,,,,,,Macrotis: A Mother's Journey,96,96,100,100,Yes
DOOM Eternal: Year One Pass (Standalone),DOOM Eternal: Year One Pass,DOOM Eternal,Phoenix Point: Year One Edition,Redemption: Eternal Quest,Doom Eternal: The Ancient Gods - Part One,,,,,,,,,,,,,,,,,DOOM Eternal: Year One Pass,81,100,83,100,Yes
Battlefield™ V Edição Definitiva,Battlefield V,Battlefield: Bad Company,Battlefield 2: Modern Combat,Battlefield: Bad Company 2,Battlefield: Bad Company 2 - Vietnam,,,,,,,,,,,,,,,,,Battlefield V,58,92,62,100,Yes
The Legend of Heroes: Trails of Cold Steel IV Digital Deluxe Edition,The Legend of Heroes VIII: Trails of Cold Steel,The Legend of Heroes: Trails of Cold Steel III,The Legend of Heroes VIII: Trails of Cold Steel II,The Legend of Heroes: Trails of Cold Steel IV,The Legend of Heroes: Trails of Cold Steel III Preorder,,,,,,,,,,,,,,,,,The Legend of Heroes: Trails of Cold Steel III,81,96,77,95,Yes
Just Dance® 2021,Just Dance 2020,Just Dance Kids,Just Dance 2018,Just Dance 2015,Just Dance 2014,,,,,,,,,,,,,,,,,Just Dance 2020,90,93,93,93,Evaluate
Santa’s Xmas Adventure,Santa's Xmas Adventure,Santa Rush-Xmas Adventure,Santa's Xmas Caper,Santa's XMas Run,Santa's Adventure,,,,,,,,,,,,,,,,,Santa's Xmas Adventure,95,95,100,100,Yes
Fishing Sim World: Bass Pro Shops Edition,Bass Pro Shops: The Strike,Bass Pro Shops: The Hunt,Fishing Sim World: Pro Tour + Giant Carp Pack,Bass Masters Classic: Pro Edition,Mass Effect: Legendary Edition,,,,,,,,,,,,,,,,,Bass Pro Shops: The Strike,54,75,55,72,No
Söldner-X 2: Final Prototype Definitive Edition,Söldner-X 2: Final Prototype,Soldner-X 2: Final Prototype,Soldner-X: Himmelssturmer,FINAL FANTASY X/X-2 HD Remaster,Mafia II: Definitive Edition,,,,,,,,,,,,,,,,,Söldner-X 2: Final Prototype,75,100,73,100,Yes
Dying Light Anniversary Edition,Dying Light: The Following - Enhanced Edition,Night Trap - 25th Anniversary Edition,Dying Light: The Following,Ankh - Anniversary Edition,Dying Light: Bad Blood,,,,,,,,,,,,,,,,,Ankh - Anniversary Edition,77,81,69,88,Evaluate
Let’s Sing 2021 - Platinum Edition,SpellForce - Platinum Edition,Let's Sing 2021,Let's Sing 2020,F.E.A.R. Platinum,Farming Simulator 2011: Platinum Edition,,,,,,,,,,,,,,,,,Let's Sing 2021,57,93,64,100,Yes
"Pacote Assassin’s Creed®: Assassin’s Creed® Valhalla, Assassin’s Creed® Odyssey e Assassin’s Creed® Origins",Assassin's Creed Odyssey,Assassin's Creed Valhalla,Assassin's Creed Origins,Assassin's Creed,Assassin's Creed Unity,,,,,,,,,,,,,,,,,Assassin's Creed,24,94,27,100,Evaluate
Fishing Sim World: Pro Tour + The Catch: Carp and Coarse,Fishing Sim World: Pro Tour + The Catch: Carp & Coarse,Fishing Sim World: Pro Tour + Giant Carp Pack,The Catch: Carp and Coarse,The Catch: Carp & Coarse,roulettemin pro: world tour,,,,,,,,,,,,,,,,,Fishing Sim World: Pro Tour + The Catch: Carp & Coarse,96,94,96,100,Yes
Ys IX: Monstrum Nox Digital Deluxe Edition,Ys IX: Monstrum Nox,Talisman: Digital Edition,Scythe: Digital Edition,Gloom: Digital Edition,DISTRAINT: Deluxe Edition,,,,,,,,,,,,,,,,,Ys IX: Monstrum Nox,62,100,61,100,Yes
DiRT Rally® PLUS PLAYSTATION®VR BUNDLE,DiRT Rally 2.0,DiRT Rally,DiRT,TERA: PlayStation Plus Pack,DiRT 2,,,,,,,,,,,,,,,,,DiRT Rally,42,100,43,100,Evaluate
NASCAR Heat 5 - Ultimate Edition,Blasting Agent: Ultimate Edition,NASCAR Heat 4,Dragon Age: Origins - Ultimate Edition,Gears of War: Ultimate Edition,Fallout: New Vegas - Ultimate Edition,,,,,,,,,,,,,,,,,NASCAR Heat 4,53,92,56,92,Evaluate
The Catch: Carp and Coarse - Collector’s Edition,The Catch: Carp and Coarse,The Catch: Carp & Coarse,Nearwood - Collector's Edition,The Last Door - Collector's Edition,Bear With Me - Collector's Edition,,,,,,,,,,,,,,,,,The Catch: Carp and Coarse,70,100,71,100,Yes
NHL™ 21 Deluxe Edition,NHL 21,DISTRAINT: Deluxe Edition,Assassin's Creed 2 Deluxe Edition,Agricultural Simulator 2012: Deluxe Edition,Mass Effect: Andromeda Deluxe Edition,,,,,,,,,,,,,,,,,Assassin's Creed 2 Deluxe Edition,65,79,63,80,No
NHL™ 21 Great Eight Edition,NHL 21,FIGHT NIGHT CHAMPION,FIFA 21,Madden NFL 21,Night Trap - 25th Anniversary Edition,,,,,,,,,,,,,,,,,FIFA 21,18,43,30,44,No
UFC® 4 Edição Deluxe,UFC 4,UFC: Throwdown,SimCity 4 Deluxe Edition,RollerCoaster Tycoon: Deluxe,Kirby: Triple Deluxe,,,,,,,,,,,,,,,,,RollerCoaster Tycoon: Deluxe,42,45,50,52,No
Atelier Mysterious Trilogy Deluxe Pack,AGON - The Mysterious Codex (Trilogy),Atelier Sophie: The Alchemist of the Mysterious Book,RIP - Trilogy,Atelier Dusk Trilogy Deluxe Pack,Metroid Prime: Trilogy,,,,,,,,,,,,,,,,,Atelier Dusk Trilogy Deluxe Pack,86,78,86,92,Evaluate
Can’t Drive This,Can't Drive This,Neon Drive,Drive-By Hero,VALKYRIE DRIVE -BHIKKHUNI,Drive!Drive!Drive!,,,,,,,,,,,,,,,,,Can't Drive This,94,94,100,100,Yes
"SWORD ART ONLINE: Alicization Lycoris, Edição Deluxe",SWORD ART ONLINE: Alicization Lycoris,Sword Art Online: Hollow Realization Deluxe Edition,Accel World VS. Sword Art Online Deluxe Edition,SWORD ART ONLINE: Hollow Realization,Sword Art Online -Hollow Fragment,,,,,,,,,,,,,,,,,SWORD ART ONLINE: Alicization Lycoris,83,100,86,100,Yes
Gal*Gun: Double Peace - Complete Edition,Gal Gun: Double Peace,Gal*Gun: Double Peace - 'Pheromone Z' Item,Nioh: Complete Edition / 仁王 Complete Edition,Gal*Gun 2,RollerCoaster Tycoon 3: Complete Edition,,,,,,,,,,,,,,,,,Gal Gun: Double Peace,66,95,70,100,Yes
Let’s Sing 2020 Platinum Edition,SpellForce - Platinum Edition,Let's Sing 2020,Let's Sing 2021,F.E.A.R. Platinum,Alex Hunter - Lord of the Mind Platinum Edition,,,,,,,,,,,,,,,,,Let's Sing 2020,60,93,64,100,Yes
