name,id,description,genres,developers,publishers,released,esrb_rating.name,parent_platforms,playtime,metacritic,game_series_count,rating,rating_top,ratings_count,reddit_count,reviews_count,suggestions_count,twitch_count,youtube_count,slug,tags,game_names,Ratio,Partial_Ratio,Token_Sort_Ratio,Token_Set_Ratio,valid_name?
Commandos 2 and Praetorians: HD Remaster Double Pack,Commandos 2 & Praetorians: HD Remaster Double Pack,Commandos 2 - HD Remaster,Praetorians - HD Remaster,S.W.I.N.E. HD Remaster,Command & Conquer Remastered Collection,,,,,,,,,,,,,,,,,Commandos 2 & Praetorians: HD Remaster Double Pack,96,94,96,100,Yes
Totally Reliable Delivery Service Deluxe Edition,Totally Reliable Delivery Service,Totally Reliable Delivery Service Beta,DISTRAINT: Deluxe Edition,Totally Reliable Delivery,Santa's Delivery Service,,,,,,,,,,,,,,,,,Totally Reliable Delivery Service,81,100,81,100,Yes
Persona®5 Royal Deluxe Edition,Persona 5 Royal,Persona 5,Persona 5 Strikers,DISTRAINT: Deluxe Edition,Persona 5: Dancing in Starlight,,,,,,,,,,,,,,,,,Persona 5 Royal,62,93,64,64,Evaluate
eFootball PES 2021 SEASON UPDATE STANDARD EDITION,eFootball PES 2021,eFootball PES 2022,eFootball PES 2020,Pro Evolution Soccer 2011,Pro Evolution Soccer 2012,,,,,,,,,,,,,,,,,eFootball PES 2021,54,100,54,100,Yes
Demon’s Tier+,Demon's Tier,Demon's Tier+,NIER,NieR Replicant v1.22474487139,Demon's Souls,,,,,,,,,,,,,,,,,Demon's Tier+,92,92,100,100,Yes
ONE PIECE: PIRATE WARRIORS 4 Edição Deluxe,ONE PIECE: PIRATE WARRIORS 4,One Piece: Pirate Warriors,One Piece Pirate Warriors 3,One Piece: Pirate Warriors 2,ONE PIECE World Seeker,,,,,,,,,,,,,,,,,ONE PIECE: PIRATE WARRIORS 4,80,100,82,100,Yes
Predator: Hunting Grounds Digital Deluxe Edition,Predator: Hunting Grounds,Talisman: Digital Edition,Scythe: Digital Edition,Gloom: Digital Edition,DISTRAINT: Deluxe Edition,,,,,,,,,,,,,,,,,Predator: Hunting Grounds,68,100,68,100,Yes
FAIRY TAIL Digital Deluxe,Fairy Tail,Fairy Tail - Hyper Fighters,Tooth and Tail,Fairy Lands: Rinka and the Fairy Gems,Fairyland: Fairy Power,,,,,,,,,,,,,,,,,Fairy Tail,57,100,57,100,Yes
Ghost of Tsushima Digital Deluxe Edition,Ghost of Tsushima,Talisman: Digital Edition,Scythe: Digital Edition,Gloom: Digital Edition,DISTRAINT: Deluxe Edition,,,,,,,,,,,,,,,,,Ghost of Tsushima,60,100,60,100,Yes
Don’t Starve Mega Pack 2020,Don't Starve Mega Pack 2020,YOU DON'T KNOW JACK,Don't Starve,Mega Man 10(2010),Don't Starve Mega Pack,,,,,,,,,,,,,,,,,Don't Starve Mega Pack 2020,96,96,100,100,Yes
World War Z - GOTY Edition,World War Z (2019),Plants vs. Zombies GOTY Edition,Blackout Z: Slaughterhouse Edition,Z End: World War,Airport Madness: World Edition,,,,,,,,,,,,,,,,,World War Z (2019),55,67,60,81,No
DOOM Eternal Edição Padrão,DOOM Eternal,Redemption: Eternal Quest,DOOM (2016),DOOM II,Ultimate Doom,,,,,,,,,,,,,,,,,DOOM Eternal,63,100,69,100,Yes
Arizona Sunshine® - Deluxe Edition,Arizona Sunshine,DISTRAINT: Deluxe Edition,Assassin's Creed 2 Deluxe Edition,Agricultural Simulator 2012: Deluxe Edition,Mass Effect: Andromeda Deluxe Edition,,,,,,,,,,,,,,,,,Arizona Sunshine,64,100,68,100,Yes
Konrad’s Kittens - Pacote de temas para gatos,Kitten adventures in city park,Bernie's Mittens 'n' Kittens,Marvin's Mittens,Juego de Papá para Lisan :),De-Void,,,,,,,,,,,,,,,,,Bernie's Mittens 'n' Kittens,41,46,43,51,No
Eastasiasoft Indie Shmup Bundle,Team Indie,Shmup-VS,Indie Graphics Bundle - Royalty Free Sprites,ATOM RPG: Post-apocalyptic indie game,GameCodeur-SHMUP,,,,,,,,,,,,,,,,,Team Indie,39,70,34,67,No
SWORD ART ONLINE Alicization Lycoris,SWORD ART ONLINE: Alicization Lycoris,SWORD ART ONLINE Alicization Lycoris,SWORD ART ONLINE: Hollow Realization,Sword Art Online -Hollow Fragment,SWORD ART ONLINE: Fatal Bullet,,,,,,,,,,,,,,,,,SWORD ART ONLINE Alicization Lycoris,100,100,100,100,Yes
Fallout 76: Aurora de Aço – Edição Deluxe,Fallout 76,Fallout 76 B.E.T.A.,Fallout 76: Wastelanders,FlatOut,Fallout: New Vegas,,,,,,,,,,,,,,,,,Fallout 76,39,100,44,100,Evaluate
MY HERO ONE’S JUSTICE 2,MY HERO ONE'S JUSTICE 2,My Hero One’s Justice,Red Comrades 2: For the Great Justice. Reloaded,Hero Zero,Injustice 2,,,,,,,,,,,,,,,,,MY HERO ONE'S JUSTICE 2,96,96,100,100,Yes
MY HERO ONE’S JUSTICE 2 Edição Deluxe,My Hero One’s Justice,MY HERO ONE'S JUSTICE 2,Assassin's Creed 2 Deluxe Edition,Mahjong Deluxe 2: Astral Planes,Red Comrades 2: For the Great Justice. Reloaded,,,,,,,,,,,,,,,,,MY HERO ONE'S JUSTICE 2,73,96,79,100,Yes
The Crew® 2 Deluxe Edition,Assassin's Creed 2 Deluxe Edition,DISTRAINT: Deluxe Edition,The Crew 2,Agricultural Simulator 2012: Deluxe Edition,Mass Effect: Andromeda Deluxe Edition,,,,,,,,,,,,,,,,,Agricultural Simulator 2012: Deluxe Edition,58,73,63,72,No
The Division 2 - Warlords of New York - Ultimate Edition,Tom Clancy’s The Division 2: Warlords of New York,Fallout: New Vegas - Ultimate Edition,Sideway New York,Vampire: The Masquerade - Coteries of New York,Vampire: The Masquerade - Shadows of New York,,,,,,,,,,,,,,,,,Fallout: New Vegas - Ultimate Edition,58,71,53,74,No
Street Fighter V: Champion Edition,Street Fighter II: Champion Edition,Street Fighter V CFN Beta,FIGHT NIGHT CHAMPION,Street Fighter Alpha 3 (1998),Street Fighter III: 3rd Strike,,,,,,,,,,,,,,,,,Street Fighter II: Champion Edition,96,94,93,97,Yes
Monster Energy Supercross 3 - Special Edition,Monster Energy Supercross - The Official Videogame,Monster Energy Supercross - The Official Videogame 3,Monster Energy Supercross - The Official Videogame 4,Jade Empire: Special Edition,Monster Energy Supercross - The Official Videogame 2,,,,,,,,,,,,,,,,,Jade Empire: Special Edition,58,64,57,71,No
DRAGON BALL Z: KAKAROT - Edição Definitiva,Dragon Ball Z: Kakarot,Dragon Ball Z: Budokai,Dragon Ball Z: Battle of Z,Dragon Ball Z: Budokai 3,Dragon Ball Z: Budokai Tenkaichi 2,,,,,,,,,,,,,,,,,Dragon Ball Z: Kakarot,69,100,72,100,Yes
The Surge 2 - Premium Edition,Dreamscapes: The Sandman - Premium Edition,Governor of Poker 2 - Premium Edition,The Surge 2,Dreamscapes: Nightmare's Heir - Premium Edition,Apothecarium: The Renaissance of Evil - Premium Edition,,,,,,,,,,,,,,,,,The Surge 2,55,100,58,100,Yes
Pacote Triplo Crash™ + Spyro™,Spyro 2: Ripto's Rage!,Skylanders Spyro's Adventure,Spyro the Dragon,Spyro: Enter the Dragonfly,Spyro: Year of the Dragon,,,,,,,,,,,,,,,,,Spyro the Dragon,36,44,54,54,No
Let’s Sing Country - Platinum Edition,Let's Sing Country,SpellForce - Platinum Edition,F.E.A.R. Platinum,Alex Hunter - Lord of the Mind Platinum Edition,Let's Sing,,,,,,,,,,,,,,,,,Let's Sing Country,62,94,68,100,Yes
STAR WARS™ Battlefront™ II: Celebration Edition,STAR WARS Battlefront 2 (2005),Star Wars: Battlefront,Star Wars: Battlefront II (2017),Star Wars Battlefront II: Resurrection,STAR WARS Battlefront,,,,,,,,,,,,,,,,,Star Wars: Battlefront,61,95,65,100,Yes
Pacote de Jogos - Crash™ Team Racing Nitro-Fueled + Spyro™,Crash Team Racing Nitro-Fueled,Crash Team Racing,CTR: Crash Team Racing,Skylanders Spyro's Adventure,Crash Tag Team Racing,,,,,,,,,,,,,,,,,Crash Team Racing Nitro-Fueled,68,97,73,100,Yes
DEEMO -Reborn-,DEEMO -Reborn,The Dolls: Reborn,Rising Angels: Reborn,Luna Online: Reborn,Gemini: Heroes Reborn,,,,,,,,,,,,,,,,,DEEMO -Reborn,96,100,100,100,Yes
Shenmue III - Digital Deluxe Edition,Shenmue,Talisman: Digital Edition,Scythe: Digital Edition,Gloom: Digital Edition,Cossacks 3: Digital Deluxe,,,,,,,,,,,,,,,,,Shenmue,33,100,34,100,Evaluate
STAR WARS Jedi: Fallen Order™ Edição Deluxe,Star Wars Jedi: Fallen Order,Star Wars: Jedi Starfighter,STAR WARS Jedi Knight - Jedi Academy,STAR WARS Jedi Knight II - Jedi Outcast,Star Wars: Jedi Trials,,,,,,,,,,,,,,,,,Star Wars Jedi: Fallen Order,79,100,82,100,Yes
Atelier Ryza: Digital Deluxe Edition,Talisman: Digital Edition,Atelier Ryza: Ever Darkness & the Secret Hideout,Scythe: Digital Edition,Gloom: Digital Edition,DISTRAINT: Deluxe Edition,,,,,,,,,,,,,,,,,Scythe: Digital Edition,64,70,60,81,No
Atelier Ryza: Ever Darkness and the Secret Hideout,Atelier Ryza: Ever Darkness & the Secret Hideout,Atelier Ryza: Ever Darkness & the Secret Hideout with bonus,Atelier Ryza 2: Lost Legends & the Secret Fairy,Atelier Ryza 2: Lost Legends and the Secret Fairy PS4 and PS5,Yokai's Secret,,,,,,,,,,,,,,,,,Atelier Ryza: Ever Darkness & the Secret Hideout,96,94,96,100,Yes
Need for Speed™ Heat,Need for Speed Heat,Need for Speed: ProStreet,Need for Speed,Need for Speed: Shift,Need for Speed: Underground,,,,,,,,,,,,,,,,,Need for Speed Heat,97,95,100,100,Yes
Call of Duty®: Modern Warfare®,Call of Duty 4: Modern Warfare,Call of Duty: Modern Warfare Remastered,Call of Duty: Modern Warfare (2019),Call of Duty: Modern Warfare 3,Call of Duty: Modern Warfare 2,,,,,,,,,,,,,,,,,Call of Duty 4: Modern Warfare,93,93,96,100,Yes
Farming Simulator 19 - Platinum Edition,Farming Simulator 19,Farming Simulator 2011: Platinum Edition,SpellForce - Platinum Edition,F.E.A.R. Platinum,Agricultural Simulator: Historical Farming,,,,,,,,,,,,,,,,,Farming Simulator 2011: Platinum Edition,91,90,95,96,Evaluate
Plants vs. Zombies™: Batalha por Neighborville Edição Deluxe,Plants vs. Zombies: Battle for Neighborville,Plants vs. Zombies,Plants vs Zombies Garden Warfare,Plants vs. Zombies GOTY Edition,Plants vs. Zombies Garden Warfare 2,,,,,,,,,,,,,,,,,Plants vs. Zombies,46,100,47,100,Evaluate
Worms Battlegrounds + Worms W.M.D,Worms W.M.D,Worms Battlegrounds + Worms W.M.D,Worms,Worms Armageddon,Worms Revolution,,,,,,,,,,,,,,,,,Worms Battlegrounds + Worms W.M.D,100,100,100,100,Yes
Zombieland: Double Tap- Road Trip,Zombieland: Double Tap - Road Trip,Zombieland: Double Tapper,ModNation Racers: Road Trip,Tap Double-tap!,Tap Double-Tap REMAKE!,,,,,,,,,,,,,,,,,Zombieland: Double Tap - Road Trip,99,97,100,100,Yes
GRID Ultimate Edition,Blasting Agent: Ultimate Edition,GRID Autosport,Dragon Age: Origins - Ultimate Edition,Gears of War: Ultimate Edition,Race Driver: Grid,,,,,,,,,,,,,,,,,Blasting Agent: Ultimate Edition,68,81,62,86,Evaluate
Tom Clancy’s Ghost Recon Breakpoint,Tom Clancy's Ghost Recon Breakpoint,Tom Clancy’s Ghost Recon Breakpoint Trial,Tom Clancy's Ghost Recon Breakpoint Beta,Tom Clancy's Ghost Recon,Tom Clancy's Ghost Recon Wildlands,,,,,,,,,,,,,,,,,Tom Clancy's Ghost Recon Breakpoint,97,97,100,100,Yes
Tom Clancy’s Ghost Recon Breakpoint Ultimate Edition,Tom Clancy's Ghost Recon Breakpoint,Tom Clancy's Ghost Recon,Tom Clancy’s Ghost Recon Breakpoint Trial,Tom Clancy's Ghost Recon Breakpoint Beta,Tom Clancy's Ghost Recon Wildlands,,,,,,,,,,,,,,,,,Tom Clancy's Ghost Recon Breakpoint,78,97,80,100,Yes
Tropico 6 El Prez Edition,Tropico 6,Tropico 6 - Beta,Halcyon 6: Lightspeed Edition,Tropico,Avernum 6,,,,,,,,,,,,,,,,,Tropico 6,53,100,53,100,Yes
Catherine: Full Body Digital Deluxe Edition,Catherine: Full Body,Catherine,Talisman: Digital Edition,Scythe: Digital Edition,Gloom: Digital Edition,,,,,,,,,,,,,,,,,Catherine: Full Body,63,100,62,100,Yes
DiRT Rally 2.0 - Game of the Year Edition,DiRT Rally 2.0,BADLAND: Game of the Year Edition,Deus Ex: Game of the Year Edition,Fallout 3: Game of the Year Edition,Borderlands 2: Game of the Year Edition,,,,,,,,,,,,,,,,,DiRT Rally 2.0,51,100,53,100,Yes
The Bard’s Tale IV: Director’s Cut,The Bard's Tale IV: Director's Cut,Q.U.B.E: Director's Cut,Deadlight: Director's Cut,The Bard's Tale,Mythos: The Beginning - Director's Cut,,,,,,,,,,,,,,,,,The Bard's Tale IV: Director's Cut,94,94,100,100,Yes
F1® 2019,F1 2017,F1 2019,F1 2016,F1 2011,F1 2013,,,,,,,,,,,,,,,,,F1 2019,93,86,100,100,Evaluate
Train Sim World® 2020,Train Sim World: CSX Heavy Haul,Train Sim World,Train Sim World 2020,Rain World,Train Simulator,,,,,,,,,,,,,,,,,Train Sim World 2020,98,95,100,100,Yes
Mutant Year Zero: Road to Eden - Deluxe Edition ,Mutant Year Zero: Road to Eden,Mutant Year Zero: Road to Eden Demo,Mutant Year Zero: Seed of Evil,DISTRAINT: Deluxe Edition,Phoenix Point: Year One Edition,,,,,,,,,,,,,,,,,Mutant Year Zero: Road to Eden,77,100,79,100,Yes
Rainbow Skies + Rainbow Moon Mega RPG Bundle,Rainbow Moon,Sky's Rainbow,Tom Clancy's Rainbow Six,Tom Clancy's Rainbow Six Vegas,Tom Clancy's Rainbow Six Parasite,,,,,,,,,,,,,,,,,Rainbow Moon,43,100,44,100,Evaluate
F1® 2019 Legends Edition Senna and Prost,F1 2017,F1 2019,F1 2016,F1 2011,F1 2013,,,,,,,,,,,,,,,,,F1 2017,26,86,26,44,Evaluate
Crash™ Team Racing Nitro-Fueled,Crash Team Racing Nitro-Fueled,Crash Team Racing,CTR: Crash Team Racing,Crash Tag Team Racing,Crash Nitro Kart,,,,,,,,,,,,,,,,,Crash Team Racing Nitro-Fueled,98,97,100,100,Yes
Horizon Shift ’81,Horizon Shift '81,Horizon Shift,Alteil: Horizons,Shift Happens,Shattered Horizon,,,,,,,,,,,,,,,,,Horizon Shift '81,94,94,100,100,Yes
Lapis x Labyrinth ,Lapis x Labyrinth,Medusa's Labyrinth,MinosMaze - The Minotaur's Labyrinth,Labyrinth,Project Druid - 2D Labyrinth Explorer,,,,,,,,,,,,,,,,,Lapis x Labyrinth,97,100,100,100,Yes
Xenon Racer - Deluxe Edition,Xenon Racer,DISTRAINT: Deluxe Edition,Assassin's Creed 2 Deluxe Edition,Agricultural Simulator 2012: Deluxe Edition,Mass Effect: Andromeda Deluxe Edition,,,,,,,,,,,,,,,,,Xenon Racer,56,100,59,100,Yes
Konrad’s Kittens Bundle,Bernie's Mittens 'n' Kittens,Marvin's Mittens,Konrad the Kitten,Kicking Kittens: Putin Saves The World,Konrad the Kitten - a virtual but real cat,,,,,,,,,,,,,,,,,Konrad the Kitten - a virtual but real cat,52,61,54,54,No
Conan Exiles – Deluxe Edition,Conan Exiles,DISTRAINT: Deluxe Edition,Assassin's Creed 2 Deluxe Edition,Agricultural Simulator 2012: Deluxe Edition,Age of Conan: Unchained,,,,,,,,,,,,,,,,,Conan Exiles,59,100,62,100,Yes
Power Rangers: Battle For The Grid - Edição de Colecionador,Power Rangers: Battle For The Grid,Power Rangers Zeo: Battle Racers,Saban’s Mighty Morphin Power Rangers: Mega Battle,GRID Autosport,Vangers,,,,,,,,,,,,,,,,,Power Rangers: Battle For The Grid,73,100,76,100,Yes
SEVEN: ENHANCED EDITION,Interplanetary: Enhanced Edition,Icewind Dale: Enhanced Edition,Planescape: Torment: Enhanced Edition,Neverwinter Nights: Enhanced Edition,Baldur's Gate: Enhanced Edition,,,,,,,,,,,,,,,,,Planescape: Torment: Enhanced Edition,73,87,74,84,Evaluate
ONE PIECE World Seeker Edição Deluxe,ONE PIECE World Seeker,ONE PIECE Unlimited World Red,One Piece: Pirate Warriors,One Piece: Unlimited World Red - Deluxe Edition,ONE PIECE: PIRATE WARRIORS 4,,,,,,,,,,,,,,,,,ONE PIECE World Seeker,76,100,79,100,Yes
Coleção LEGO® Marvel,LEGO Marvel's Avengers,LEGO Marvel Super Heroes,LEGO Marvel Collection,Marvel’s Avengers,LEGO Marvel's Avengers - Classic Captain Marvel Pack,,,,,,,,,,,,,,,,,LEGO Marvel's Avengers - Classic Captain Marvel Pack,39,45,42,79,No
The Walking Vegetables: Radical Edition,The Walking Vegetables,OVERKILL's The Walking Dead,The Escapists: The Walking Dead,The Walking Dead: Michonne,The Walking Dead: Season 1,,,,,,,,,,,,,,,,,The Walking Vegetables,72,100,73,100,Yes
Anthem™ - Edição Legião da Alvorada,Anthem,Re-Legion,Erica,Watch Dogs Legion,Littlewitch Romanesque: Editio Regia,,,,,,,,,,,,,,,,,Anthem,29,100,34,100,Evaluate
Quase Lá: O jogo de plataforma,Pastor de Ovelhas - O Jogo,Mariana: O Jogo,Furtivo - O Jogo,PAINT - O Jogo,Arquijaz: o Jogo,,,,,,,,,,,,,,,,,Furtivo - O Jogo,39,56,33,60,No
ACE COMBAT™ 7: SKIES UNKNOWN,ACE COMBAT 7: SKIES UNKNOWN,Ace Combat: Assault Horizon,Ace Combat 04: Shattered Skies,Ace Combat XI: Skies of Incursion,Ace Combat 6: Fires of Liberation,,,,,,,,,,,,,,,,,ACE COMBAT 7: SKIES UNKNOWN,98,96,100,100,Yes
SWORD ART ONLINE: FATAL BULLET Edição Completa,SWORD ART ONLINE: Fatal Bullet,SWORD ART ONLINE: FATAL BULLET Demo,SWORD ART ONLINE: Hollow Realization,Sword Art Online -Hollow Fragment,Sword Art Online: Lost Song,,,,,,,,,,,,,,,,,SWORD ART ONLINE: Fatal Bullet,79,100,81,100,Yes
Tales of Vesperia™: Edição Definitiva,Tales of Vesperia: Definitive Edition,Tales of Vesperia,Tales of Esferia: Araxis,Tales of Symphonia (2003),Tick's Tales,,,,,,,,,,,,,,,,,Tales of Vesperia,63,100,68,100,Yes
Override: Mech City Brawl - Super Charged Mega Edition,Override: Mech City Brawl,Override: Mech City Brawl - CLOSED BETA,Override 2: Super Mech League,Super Smash Bros. Brawl,Crawl N' Brawl,,,,,,,,,,,,,,,,,Override: Mech City Brawl,63,100,64,100,Yes
Darksiders III Blades and Whip Edition,Darksiders II Deathinitive Edition,Darksiders Warmastered Edition,Darksiders III,Mount & Blade,SpellForce 3: Versus Edition,,,,,,,,,,,,,,,,,Darksiders III,54,100,54,100,Yes
Darksiders III Digital Deluxe Edition,Darksiders II Deathinitive Edition,Darksiders III - Digital Extras,Talisman: Digital Edition,Scythe: Digital Edition,Gloom: Digital Edition,,,,,,,,,,,,,,,,,Scythe: Digital Edition,60,70,54,81,No
Farming Simulator 19 - Premium Edition,Farming Simulator 19,Dreamscapes: The Sandman - Premium Edition,Agricultural Simulator: Historical Farming,Farming Simulator 19: Real Tractor Farming Game,Dreamscapes: Nightmare's Heir - Premium Edition,,,,,,,,,,,,,,,,,Farming Simulator 19,69,100,71,100,Yes
Aces of the Luftwaffe - Squadron Extended Edition,Aces of the Luftwaffe - Squadron,Anna - Extended Edition,Rise of Nations: Extended Edition,Age of Mythology: Extended Edition,Aces of the Luftwaffe,,,,,,,,,,,,,,,,,Aces of the Luftwaffe - Squadron,79,100,78,100,Yes
HITMAN™ 2,HITMAN 2 - Prologue,Hitman 2: Silent Assassin,Hitman,Hitman 2,Hitman: Absolution,,,,,,,,,,,,,,,,,Hitman 2,94,88,100,100,Evaluate
Knowledge is Power:Decades,Knowledge is Power: Decades,Knowledge is Power,Apocalipsis: The Tree of the Knowledge of Good and Evil,Community College Hero: Knowledge is Power,Self-knowledge VR,,,,,,,,,,,,,,,,,Knowledge is Power: Decades,98,96,100,100,Yes
HITMAN 2 - Edição Ouro,HITMAN 2 - Prologue,Hitman 2: Silent Assassin,Hitman,Hitman 2,Hitman: Absolution,,,,,,,,,,,,,,,,,Hitman 2,53,100,62,100,Yes
Tetris® Effect,Tetris Effect: Connected,Tetris Effect,Tetris (1984),Fear Effect Sedna,Mass Effect: Andromeda,,,,,,,,,,,,,,,,,Tetris Effect,96,92,100,100,Yes
The Sims™ 4 + Gatos e Cães – Bundle,The Sims 4,The Sims,Cally's Caves 4,The Sims 4: Cats & Dogs,The Sims 2: University,,,,,,,,,,,,,,,,,The Sims,37,100,43,100,Evaluate
MudRunner - American Wilds Edition,MudRunner - American Wilds Expansion,Spintires: Mudrunner - American Wilds,MudRunner,Spintires: MudRunner,MudRunner – American Wilds,,,,,,,,,,,,,,,,,MudRunner – American Wilds,83,96,86,100,Yes
Nickelodeon Kart Racers,Nickelodeon: Kart Racers,Nickelodeon Kart Racers,Nickelodeon Kart Racers 2: Grand Prix,Garfield Kart - Furious Racing,LEGO Racers,,,,,,,,,,,,,,,,,Nickelodeon Kart Racers,100,100,100,100,Yes
LEGO® DC Super-Vilões Edição Deluxe,LEGO DC Super-Villains,LEGO Batman 2 DC Super Heroes,LEGO Marvel Super Heroes,LEGO The Hobbit,New Super Mario Bros. U Deluxe,,,,,,,,,,,,,,,,,LEGO The Hobbit,32,40,35,42,No
Assassin’s Creed® Odyssey Gold Edition,Assassin's Creed Odyssey,Assassin's Creed,Assassin's Creed: Director's Cut Edition,Assassin's Creed Unity,Assassin's Creed: Bloodlines,,,,,,,,,,,,,,,,,Assassin's Creed,56,94,60,100,Yes
Creed Rise to Glory™,Creed: Rise to Glory,Warriors: Rise to Glory!,Fallen Legion: Rise to Glory,Assassin's Creed,Ticket to Ride,,,,,,,,,,,,,,,,,Creed: Rise to Glory,95,95,100,100,Yes
Edição Ultimate do Tom Clancy’s Ghost Recon® Wildlands,Tom Clancy's Ghost Recon Wildlands,Tom Clancy's Ghost Recon,Tom Clancy's Ghost Recon Breakpoint,Tom Clancy's Ghost Recon: Island Thunder,Tom Clancy's Ghost Recon: Desert Siege,,,,,,,,,,,,,,,,,Tom Clancy's Ghost Recon,59,96,64,100,Yes
Fishing Sim World®: Pro Tour,Fishing Sim World: Pro Tour + Giant Carp Pack,Fishing Sim World: Pro Tour + The Catch: Carp & Coarse,roulettemin pro: world tour,Table Top Racing: World Tour,Train Sim World: CSX Heavy Haul,,,,,,,,,,,,,,,,,Fishing Sim World: Pro Tour + The Catch: Carp & Coarse,66,96,70,100,Yes
Disgaea 5 Complete Bundle,DISGAEA 5: ALLIANCE OF VENGEANCE,Disgaea 4 Complete+,Disgaea 5 Complete,Disgaea 5 Complete / 魔界戦記ディスガイア5,Disgaea 4: A Promise Revisited,,,,,,,,,,,,,,,,,Disgaea 5 Complete,84,100,84,100,Yes
Mega Man X Legacy Collection 1+2,Mega Man X Legacy Collection 2,Mega Man X Legacy Collection,Mega Man Legacy Collection 2 / ロックマン クラシックス コレクション 2,Mega Man Legacy Collection / ロックマン クラシックス コレクション,Mega Man 10(2010),,,,,,,,,,,,,,,,,Mega Man X Legacy Collection 2,97,97,97,100,Yes
ONRUSH DIGITAL DELUXE EDITION,Talisman: Digital Edition,Scythe: Digital Edition,Gloom: Digital Edition,DISTRAINT: Deluxe Edition,Iron Front: Digital War Edition,,,,,,,,,,,,,,,,,Gloom: Digital Edition,67,68,68,83,No
ONRUSH STANDARD DIGITAL EDITION,Talisman: Digital Edition,Scythe: Digital Edition,Gloom: Digital Edition,Iron Front: Digital War Edition,Pixeo Mazeo - Standard Edition,,,,,,,,,,,,,,,,,Gloom: Digital Edition,64,73,65,83,No
Overwatch: Legendary Edition,Mass Effect: Legendary Edition,Blood Bowl Legendary Edition,Memory: Overwatch Edition,The Elder Scrolls V: Skyrim Legendary Edition,Overwatch,,,,,,,,,,,,,,,,,Overwatch,49,100,50,100,Evaluate
DOOM + Wolfenstein II Bundle,Wolfenstein 2: The New Colossus,Wolfenstein: Cyberpilot,DOOM II,Wolfenstein: Youngblood,Wolfenstein: The New Order,,,,,,,,,,,,,,,,,DOOM II,40,71,42,100,Evaluate
Skyrim Special Edition + Fallout 4 G.O.T.Y. Bundle,The Elder Scrolls V: Skyrim Special Edition,Devil May Cry 4: Special Edition,Fallout 4,Jade Empire: Special Edition,Dracula 4 and 5 - Special,,,,,,,,,,,,,,,,,Fallout 4,31,100,32,100,Evaluate
God of War Digital Deluxe Edition,God of War (2005),Iron Front: Digital War Edition,God of War: Ascension,God of War: Ragnarok,God of War II,,,,,,,,,,,,,,,,,God of War: Ascension,59,62,60,67,No
Extinction,eXtinction (2002),Extinction,The Extinction (2015),Nexomon: Extinction,Primal Carnage: Extinction,,,,,,,,,,,,,,,,,Extinction,100,100,100,100,Yes
Extinction: Deluxe Edition,DISTRAINT: Deluxe Edition,The Extinction (2015),Nexomon: Extinction,eXtinction (2002),Assassin's Creed 2 Deluxe Edition,,,,,,,,,,,,,,,,,eXtinction (2002),51,65,55,80,No
Ni no Kuni™ II: REVENANT KINGDOM,Ni no Kuni II: Revenant Kingdom,Ni no Kuni: Wrath of the White Witch,Ni no Kuni: Wrath of the White Witch Remastered,Kingdom Wars 2: Battles,Ni no Kuni: Dominion of the Dark Djinn,,,,,,,,,,,,,,,,,Ni no Kuni II: Revenant Kingdom,98,97,100,100,Yes
Burnout™ Paradise Remastered,Burnout Paradise Remastered,Burnout Paradise: The Ultimate Box,Burnout Paradise,Burnout 3: Takedown,burnout.,,,,,,,,,,,,,,,,,Burnout Paradise Remastered,98,96,100,100,Yes
Devil May Cry HD Collection and 4SE Bundle,DmC: Devil May Cry,Devil May Cry 5,Devil May Cry HD Collection,Devil May Cry 3: Dante's Awakening,Devil May Cry 4: Special Edition,,,,,,,,,,,,,,,,,Devil May Cry HD Collection,78,100,78,100,Yes
Konrad’s Kittens,Bernie's Mittens 'n' Kittens,Marvin's Mittens,Konrad the Kitten,Kicking Kittens: Putin Saves The World,Konrad the Kitten - a virtual but real cat,,,,,,,,,,,,,,,,,Kicking Kittens: Putin Saves The World,37,62,42,61,No
Xenon Valkyrie+,Xenon Valkyrie,Xenon Valkyrie (itch),VALKYRIE DRIVE -BHIKKHUNI,Valkyria Chronicles,Xenon Racer,,,,,,,,,,,,,,,,,Xenon Valkyrie,97,100,100,100,Yes
DRAGON BALL FIGHTERZ - FighterZ Edition,DRAGON BALL FighterZ,DRAGON BALL FIGHTERZ - Open Beta,Street Fighter II: Champion Edition,STAR WARS: TIE Fighter Special Edition,Jay Fighter: Remastered,,,,,,,,,,,,,,,,,DRAGON BALL FighterZ,68,100,70,100,Yes
SONIC FORCES Edição Digital Standard,Sonic Forces,Sonic Forces: Speed Battle,Sonic Generations,Sonic Adventure,Sonic's UGC,,,,,,,,,,,,,,,,,Sonic Forces,50,100,52,100,Evaluate
Kerbal Space Program Enhanced Edition,Space Hulk: Deathwing - Enhanced Edition,Kerbal Space Program,Interplanetary: Enhanced Edition,Kerbal Space Program - Making History,Icewind Dale: Enhanced Edition,,,,,,,,,,,,,,,,,Kerbal Space Program,70,100,70,100,Yes
Grand Theft Auto V: Edição Premium,Grand Theft Auto V,Grand Theft Auto IV,Grand Theft Auto: London 1961,Grand Theft Auto V & Grand Theft Auto: San Andreas,Grand Theft Auto: Chinatown Wars,,,,,,,,,,,,,,,,,Grand Theft Auto V,69,100,73,100,Yes
Vegas Party,Vegas Party (2017),Vegas Party,Panty Party,Fallout: New Vegas,Dungeon-Party,,,,,,,,,,,,,,,,,Vegas Party,100,100,100,100,Yes
Dead Rising 4: Frank’s Big Package,Dead Rising 4: Frank's Big Package,Dead Rising 4,Zombie Army 4: Dead War,Frank's Big Job,Dead Rising 3 Apocalypse Edition,,,,,,,,,,,,,,,,,Dead Rising 4: Frank's Big Package,97,97,100,100,Yes
Arizona Sunshine®,Arizona Sunshine,Camp Sunshine,Aritana and the Harpy's Feather,3dSunshine,Super Mario Sunshine,,,,,,,,,,,,,,,,,Arizona Sunshine,97,100,100,100,Yes
Loading Human - Chapter 1,Loading Human: Chapter 1,Mirrored - Chapter 1,Deltarune (Chapter 1),Life of Lon: Chapter 1,Rain of Reflections: Chapter 1,,,,,,,,,,,,,,,,,Loading Human: Chapter 1,94,92,100,100,Yes
The Sims™ 4 Edição Festa Deluxe,The Sims 4,The Sims,The Sims 2: University,The Sims 2: Pets,The Sims 3 Pets,,,,,,,,,,,,,,,,,The Sims,41,100,44,100,Evaluate
LEGO® Marvel Super Heroes 2,LEGO Marvel Super Heroes,LEGO Batman 2 DC Super Heroes,Marvel Heroes,LEGO Marvel's Avengers,LEGO Marvel Super Heroes 2,,,,,,,,,,,,,,,,,LEGO Marvel Super Heroes 2,98,96,100,100,Yes
Need for Speed™ Payback - Deluxe Edition,Need for Speed Payback,Need for Speed: ProStreet,Need for Speed,Need for Speed: Shift,Need for Speed: Underground,,,,,,,,,,,,,,,,,Need for Speed,52,100,55,100,Yes
Wuppo - Deluxe Edition,Wuppo,DISTRAINT: Deluxe Edition,Assassin's Creed 2 Deluxe Edition,Agricultural Simulator 2012: Deluxe Edition,Mass Effect: Andromeda Deluxe Edition,,,,,,,,,,,,,,,,,Wuppo,37,100,40,100,Evaluate
Wuppo - Super Deluxe Edition,Wuppo,DISTRAINT: Deluxe Edition,Assassin's Creed 2 Deluxe Edition,Agricultural Simulator 2012: Deluxe Edition,Mass Effect: Andromeda Deluxe Edition,,,,,,,,,,,,,,,,,Wuppo,30,100,32,100,Evaluate
Assassin’s Creed® Origins Gold Edition,Assassin's Creed Origins,Assassin's Creed,Assassin's Creed: Director's Cut Edition,Assassin's Creed Unity,Assassin's Creed: Bloodlines,,,,,,,,,,,,,,,,,Assassin's Creed,56,94,60,100,Yes
